Shelton,Allen,Allen Shelton,7/2/1936,11/21/2009,"Reidsville, NC","Westmoreland, TN","Nashville, TN","Allen Shelton was a five-string banjo player known for playing with Jim and jesse's Virginia Boys in the 1960s. He quit playing music in 1966, but later returned to play with Jim and Jesse in the 1970s.","Shelton ventured out to Berkeley to play with Jim and Jesse in the 1960s, and he was known for his experimental picking style among bluegrass enthusiasts. ",http://e.snmc.io/lk/f/a/d664c44fd43de5cee3801212f31b8d82/3915950.jpg,https://www.youtube.com/watch?v=8NdiNXmvA64,Mac Wiseman,https://en.wikipedia.org/wiki/Allen_Shelton,Musical; bluegrass,2E; 3E,,,
Winter,John,John Winter,2/23/1944,7/16/2014,"Beaumont, TX","Zurich, Switzerland","New York, NY","John Dawson Winter III, popularly known as Johnny Winter, was a singer-songwriter and guitarist who specialized in blues and rock music. He has been remembered for being one of the most talented blues guitarists who ever lived. ","Winter was already world-famous by the 1960s, and he played and collaborated with some of the most famous 1960s musicians like Janis Joplin and Muddy Waters.",http://assets.rollingstone.com/assets/images/story/the-lion-in-johnny-winter-a-tribute-to-the-guitar-icon-20140717/winter-624-1405612028.jpg,https://www.youtube.com/watch?v=8Tyg5SJDpiQ,Janis Joplin; Bob Dylan; B.B. King ,https://en.wikipedia.org/wiki/Johnny_Winter,Musical; blues; rock,2E; 3E,,,"Both John Winter and Johnathan Winters are on this map, but I understand they are different people. Also, in the 1990s Winter and his brother Edgar sued DC Comics and the Jonah Hex series for having two characters, named Johnny and Edgar Autumn. They sued for defamation. Interesting intersection between music and comic books!"
Burnham,Don,Don Burnham,6/3/1947,,"San Francisco, CA",,"New York, NY","Don Burnham is guitarist a San Francisco native who was active in the Berkeley folk music scene in the 1960s. After serving in the army for some years, he worked in New York as a news assistant for NBC before returning to California to partake in the West Coast music scene. Since then, he has continued to write and perform folk songs.","Burnham was active in the Bay Area folk music scene in the 1960s before joining the army, so Berkeley folk music enthusiasts might have heard his music. ",https://gp1.wac.edgecastcdn.net/802892/http_public_production/artists/images/758655/original/hash:1466640055/1371856314_Don_w_Gibson_345_framed.jpg?1466640055,https://www.youtube.com/watch?v=vtfOxF9zUHs,,http://www.donburnham.com/bio.htm,Musical; folk; local,2E; 3E,,,
Terry,Clark,Clark Terry,12/14/1920,2/21/2015,"St. Louis, MO","Pine Bluff, AR","New York, NY","Clark Terry was a musician who specialized in jazz music and played the trumpet and the flugelhorn. He is remembered for being one of the most influential jazz musicians of the mid twentieth century, and he mentored famous musicians like Quincy Jones and Miles Davis.","Terry was at the peak of his career in the 1960s, and jazz enthusiasts in Berkeley probably listened to his music. ",http://www.haworthnj.org/vertical/Sites/%7B3226EF68-541C-456F-8644-AC724E9AC52C%7D/uploads/%7B4E65E255-EB4D-46F1-89D1-F9CFE3BE3487%7D.JPG,https://www.youtube.com/watch?v=bwZiJAFWWfw,,https://en.wikipedia.org/wiki/Clark_Terry,Musical; jazz,2E; 3E,,,
Thorrud,Ron,Ron Thorrud,,,,,,,,,,,,,3E,,,
Montgomery,Wes,Wes Montgomery,3/6/1923,6/15/1968,"Indianapolis, IN","Indianapolis, IN",,Wes Montgomery was a jazz guitarists who is remembered for being one of the most influential jazz musicians of the mid twentieth century. He is particularly known for playing being a founder of the smooth jazz genre. ,Montgomery was at the height of his career in the 1960s until his tragic death from a heart attack in 1968. Berkeley jazz enthusiasts probably had listened to his work.  ,https://www.allaboutjazz.com/media/large/1/f/1/b9d89e1bcdc07fcd4b5728a5e884b.jpg,https://www.youtube.com/watch?v=EksUgcyXoO8,,https://en.wikipedia.org/wiki/Wes_Montgomery,Musical; jazz,3E,,,
Frankel,Ken,Ken Frankel,,,,,"Berkeley, CA; Boston, MA","Ken Frankel is a guitar player who has played in several folk, rock, and bluegrass groups. His career has spanned since the 1950s to present day, and he continues to play today. When not playing music, he worked as a physicist  in Berkeley.","Frankel was well-involved in the Berkeley folk music scene, and he played with artists like Jerry Garcia and even Rick Shubb himself!",https://princewritesblog.files.wordpress.com/2013/05/942819_565816770105570_1173232810_n.jpg?w=470,https://www.youtube.com/watch?v=iXgJG6C5HDw,Jerry Garcia,http://www.kenfrankel.com/music_info.html,Musical; bluegrass; folk; local,3E,,,He talks about Rick Shubb on his website!
Dollett,John,John Dollett,,,,,,,,,,,,,3E,,,
Spivey,Victoria,Victoria Spivey,10/15/1906,10/3/1976,"Houston, TX","New York, NY","St. Louis, MO","Victoria Spivey was a blues singer-songwriter who has worked with artists like Louis Armstrong and Bob Dylan. She performed from the 1910s to her death in 1976, and though her career declined in the 1930s due to the Depression, she found new success in the 1960s amidst the American folk music revival. ","Spivey was one of the most famous female blues artists to record in the 1920s, and she was active in the New York blues scene in the 1960s. So, Berkeley blues fans probably heard her music. ",https://i.ytimg.com/vi/XZ06tV2QnVQ/hqdefault.jpg,https://www.youtube.com/watch?v=5lXV96VwnVY,Bob Dylan,https://en.wikipedia.org/wiki/Victoria_Spivey,Musical; blues,3E,,,
Carvey,Tom,Tom Carvey,,,,,,,,,,,,,3E,,,"There is a Tom Carvey Allmusic profile for someone who contributed vocals to a Judy Collins album, but that's all I got: http://www.allmusic.com/artist/tom-carvey-mn0001625724"
Scoville,Jon,Jon Scoville,,,Connecticut,,"Salt Lake City, UT; New York, NY; Santa Cruz, CA","Jon Scoville is a composer and music director famous for working with many dancers. He currently works as the music director for Tandy Beal and Company with his wife, Tandy Beal, a dancer and choreographer. ","Scoville and Tandy Beal were active in the West Coast arts scene, and Berkeley residents might have heard his work as a performer. ",https://static1.squarespace.com/static/541da3abe4b0450bd7d29a0a/t/547a9b41e4b07347e7713729/1417321282404/jscropped.jpg?format=300w,https://www.youtube.com/watch?v=Bkuasz43Ow0,Tandy Beal,http://www.tandybeal.com/the-founders/,Musical; local,3E,,,
Willy,Bale Hook,Bale Hook Willy,,,,,,,,,,,,,3E,,,"The Humbead website lists his name as ""Balehook,"" but the map clearly has two words. Neither of these options turns up anything in google search. "
Miller,Evelyn,Evelyn Miller,,,,,,,,,,,,,3E,,,
Schoenfeld,Sally,Sally Schoenfeld,,,,,"Boston, MA","Sally Schoenfeld was a student at Wellesley who was involved in the Cambridge folk music scene. She performed with Buzz Marten, another figure in the Cambridge folk music scene. ",Berkeley folk music enthusiasts might have heard from Schoenfeld due to her performances in Cambridge. ,,,Buzzy Marten,https://books.google.com/books?id=fCyYqAIh0CEC&pg=PA121&lpg=PA121&dq=sally+schoenfeld+berkeley&source=bl&ots=FpaBIIcrar&sig=Lk37qCYr8lWigm7RXFGg2Oq9l0I&hl=en&sa=X&ved=0ahUKEwjat8mvnPjTAhXGxVQKHZFFBi0Q6AEIKzAB#v=onepage&q=sally%20schoenfeld%20berkeley&f=false,Musical; folk,3E,,,"This section in Baby, Let Me Follow You Down that I have cited was pretty enlightening. It describes Buzz Marten's transition from Cambridge to Berkeley. They even show Humbead's map!"
Grant,Laird,Laird Grant,,,,,"San Francisco, CA",Laird Grant was the Grateful Dead's first roadie and one of Jerry Garcia's oldest friends. ,"Grant was a native of the Bay Area, and he became mildly famous due to his involvement with the Grateful Dead, one of the most famous bands to come out of San Francisco. ",,,Jerry Garcia; Pigpen McKernan,http://www.levity.com/gans/SFFocus.html,Musical; local; Grateful Dead,3E,,,
Davidson,Harley,Harley Davidson,,,,,,"Harley Davidson is a motorcycle manufacturer founded in Wisconsin. Besides motorcycles, the company licenses merchandise including apparel, home decor, accessories, and toys. It remains the most popular motorcycle brand today. ",This reference could be an allusion to one of the most iconic brands in American culture. ,https://upload.wikimedia.org/wikipedia/en/thumb/b/b2/Harley-Davidson.svg/1200px-Harley-Davidson.svg.png,https://www.youtube.com/watch?v=yFHV7cTwm1g,Bob Dylan,https://en.wikipedia.org/wiki/Harley-Davidson,Brand,3E,,,
Keith,Bill,Bill Keith,12/20/1939,10/23/2015,"Boston, MA","Woodstock, NY",,"Bill Keith was a five-string banjo player specializing in bluegrass music known for playing with BIll Monroe's Bluegrass Boys and the Jim Kweskin Jug Band. He is remembered for contributing to the stylistic development of the banjo as well as his unique picking style, known as ""Keith style.""","Keith ventured out to Berkeley to play with the Jim Kweskin Jug Band, and he was well-known among bluegrass enthusiasts for his music. ",http://www.jimrooneyproductions.com/wp-content/gallery/bill-keith-1939-2015/20Bill-Keith_Ireland.jpg,https://www.youtube.com/watch?v=Q3QlfvOOt9c,Bill Monroe; Jim Kweskin; Earl Scruggs,https://en.wikipedia.org/wiki/Bill_Keith_(musician),Musical; bluegrass,3E,,,
Williamson,Al,Al Williamson,3/21/1931,6/12/2010,"New York, NY",Upstate NY,"Bogot??, Colombia","Al Williamson was a cartoonist who specialized in adventure, Western, and science fiction comics. Over his long career from the 1950s to the 2000s, he has worked on strips like Flash Gordon, Creepy (a horror comic), and the comic book adaptations of the Star Wars films. ",,https://upload.wikimedia.org/wikipedia/en/thumb/8/86/Alwilliamsontable.jpg/220px-Alwilliamsontable.jpg,https://www.youtube.com/watch?v=wMiWA8TFrlY,Angelo Torres,https://en.wikipedia.org/wiki/Al_Williamson,Comic book,3E,,,
Shaw,Ann,Ann Shaw,11/21/1921,5/5/2015,"Columbus, OH","Los Angeles, CA",,"Ann Shaw was a social worker and organizer who was active in civic engagement in Los Angeles for several decades. She was the first African American to head a YWCA chapter, and the first African American woman to serve on the California Commission on Judicial Performance. ","Shaw was known in California for her work as a civic leader in Los Angeles, so Berkeley residents likely knew of her. ",http://www.trbimg.com/img-555173ac/turbine/la-ann-shaw-kids-jpg-20150511/650/650x366,,,https://en.wikipedia.org/wiki/Ann_Shaw_(social_worker),Political,3E,,,"There are quite a few Ann Shaw's out there, but I think this is the right one. "
Mouse,Spike,Spike Mouse,,,,,,,,,,,,,3E,,,
Biasotti,Dave,Dave Biasotti,,,,,,"Dave Biasotti was a journalist based in California who often wrote for the music magazine Ugly Things. He often wrote for underground publications and music publications, and he wrote a 26,000-word essay on the Berkeley psychedelic rock band Mad River.","While it is uncertain if Biasotti actually resided in Berkeley, he was certainly involved in the local music scene as a journalist. ",,,,http://berkeleyfolk.blogspot.com/2011/,Journalist,3E,,,
Paul,John,John Paul,,,,,,,,,,,,,3E,,,There are too many John Paul's out there to know who they're talking about. Is it the Pope? Is it this folk guy (https://johnpauloconnor.com/about/)? I really don't know. 
Kantner,Paul,Paul Kantner,3/17/1941,1/28/2016,"San Francisco, CA","San Francisco, CA",,"Paul Kantner was a rhythm guitarist who played for Jefferson Airplane, one of the most famous rock bands of the 1960s. He continued to play with his band Jefferson Starship after Jefferson Airplane broke up in 1972. ","Kantner was a San Francisco native, and Jefferson Airplane was one of the most famous bands to come out of the Bay Area in the 1960s. So, Kantner was certainly a local celebrity. ",https://s3-us-west-2.amazonaws.com/find-a-grave-prod/photos/2016/27/157551621_1454030018.jpg,https://www.youtube.com/watch?v=SMatOgblIog,Grace Slick,https://en.wikipedia.org/wiki/Paul_Kantner,Musical; rock; psychedelic,3E,,,
,,Wolo,,,,,,,,,,,,,3E,,,
Spencer,Lena,Lena Spencer,1/4/1923,11/9/1989,"Milford, MA","Saratoga Springs, NY",,"Lena Spencer was a folk music enthusiast and occasional singer famous for owning the internationally renowned folk music club Caffe Lena in Saratoga Springs, New York. Her Caffe Attracted performers like Bob Dylan and Don McLean. She tied in 1989 after falling down a flight of stairs in the cafe, but the Caffe continues to run today. ",Berkeley folk music enthusiasts likely knew about Caffe Lena due to its popularity among folk music artists. ,http://qcpages.qc.cuny.edu/calandra/sites/calandra.i-italy.org/files/imagecache/fullsize/seminar_nov4_0.jpg,https://www.youtube.com/watch?v=-a7Ijl7z8bY,,http://www.timesunion.com/news/article/Lena-Spencer-nurtured-community-that-rallied-to-555267.php,Musical; folk; celebrity,3E,,,
Newman,Margie,Margie Newman,,,,,,,,,,,,,3E,,,
Williams,Nat,Nat Williams,,,,,,,,,,,,,3E,,,
Patte,Lance,Lance Patte,,,,,,,,,,,,,3E,,,
Wilcox,Yvonne,Yvonne Wilcox,,,,,,,,,,,,,3E,,,
Sweezy,Nancy,Nancy Sweezy,10/14/1921,2/6/2010,"New York, NY","Boston, MA",,"Nancy Sweezy was an an artist and folklorist known for her work in pottery. She is famous for helping revive North Carolina's Jugtown Pottery, as well as for participating in the Cambridge folk music scene and creating a refugee arts group for immigrant folk artists in Boston. ",Sweezy's work in pottery and folklore likely caught the attention of Berkeley intellectuals interested in folk culture. ,https://www.arts.gov/sites/default/files/styles/large-620/public/gallery/2013/2006NancySweezy.jpg?itok=TysRrZug,https://www.youtube.com/watch?v=DQJ3UmPIhQ0,,https://en.wikipedia.org/wiki/Nancy_Sweezy,Folk,3E,,,
Garcia,Heather,Heather Garcia,12/7/1963,,"San Francisco, CA",,,"Heather Garcia is a violinist known for being Jerry Garcia's first daughter. She is the daughter of Garcia's first wife, Sara Ruppenthal. ","Heather was born in 1963, and so Deadheads probably knew about her due to her famous father. ",,,Jerry Garcia,https://en.wikipedia.org/wiki/Jerry_Garcia,Local; Grateful Dead,3E,,,
Koch,Art,Art Koch,,,,,,,,,,,,,3E,,,
Tolkien,J.R.R.,J.R.R. Tolkien,1/3/1892,9/2/1973,"Bloemfontein, South Africa","Bournemouth, United Kingdom","Oxford, United Kingdom; Birmingham, United Kingdom;","Professor of Anglo-Saxon at Oxford and author of famous books like The Hobbit and The Lord of the Rings.Became involved in ""counter-cultural"" issues in the 1960s largely due to his concern for the environment.","Tolkien's books were popularly read through the duration of the Berkeley Folk Music Festival. As an academic, he represents the relationship between counterculture and academia during this time period.",http://i.huffpost.com/gen/1478293/images/o-JRR-TOLKIEN-facebook.jpg,https://youtu.be/zqchWeeSZsw?t=7s,,https://en.wikipedia.org/wiki/J._R._R._Tolkien,Literary; academic,3E,,,Tolkien was very active in 1960s countercultural activism. Interesting!
Flatt,Lester,Lester Flatt,6/19/1914,5/11/1979,"County, TN","Nashville, TN",,"Lester Flatt was a bluegrass guitarist and mandolinist best known for collaborating with Earl Scruggs with the Foggy Mountain Boys (also known as Flatt and Scruggs). He originally played with Bill Monroe's band, and his career was particularly active in the 1960s folk music revival. ","Flatt performed at the Berkeley Folk Music Festival, and he was one of the most famous bluegrass musicians of the mid twentieth century. ",http://www.bothkindsradio.com/wp-content/uploads/2014/06/lesterflatt-9f64202efae94768357e5708149fef949f06b0bb-s6-c30.jpg,https://www.youtube.com/watch?v=wvXACf4MO8U,Earl Scruggs; Bill Monroe,https://en.wikipedia.org/wiki/Lester_Flatt,Musical; bluegrass,3E,,,
Hammond,John,John Hammond,12/15/1910,7/10/1987,"New York, NY","New York, NY","New Haven, CT","John Hammond was a record producer who is remembered for being one of the most influential figures in twentieth-century pop music. He was instrumental in the careers of several artists including Bob Dylan, Bruce Springsteen, Billie Holiday, Aretha Franklin, and Leonard Cohen. He was also active in the Civil Rights movement and radical politics, to the point that J. Edgar Hoover investigated his link to the Communist Party. ","While it is uncertain if Hammond ever ventured to North California, he was instrumental in the careers of several folk, rock, and jazz music artists.",https://s-media-cache-ak0.pinimg.com/originals/05/27/d4/0527d45e293e6eefab17127d0d66c6b2.jpg,https://www.youtube.com/watch?v=Sv80gzwDtdg,Bob Dylan; Aretha Franklin; Pete Seeger,https://en.wikipedia.org/wiki/John_Hammond_(producer),Musical; folk; rock; jazz; blues,3E,,,
King,Gary,Gary King,,,,,,,,,,,,,3E,,,
Leicester,Marshall,Marshall Leicester,,,,,"San Francisco, CA",Marshall Leicester was a banjo and guitar player known for playing in the bluegrass band Sleepy Hollow Hog Stompers along with Jerry Garcia and Robert Hunter.,"The Sleepy Hollow Hog Stompers played in several Bay Area venues, and Leicester's association with Jerry Garcia probably made him a popular figure. ",,https://www.youtube.com/watch?v=5Vlyu7a__f4,Jerry Garcia,http://www.deaddisc.com/GDFD_Garcia_1961_1964.htm,Musical; bluegrass; local,3E,,,
Nelson,Melvin,Melvin Nelson,,,,,,,,,,,,,3E,,,
Smith,Steve,Steve Smith,,,,,,,,,,,,,3E,,,"There are just too many Steve Smith's out there to know who they're talking about. There are several different Steve Smith's listed on Wikipedia, so I don't even know where to start!"
Van Hook,Clarence,Clarence Van Hook,,,Arkansas,,"Oakland, CA",Clarence Van Hook is a blues guitar player who often played gigs in the Bay Area. He is remembered for being a Bay Area blues legend. ,Berkeley blues enthusiasts had probably heard of Clarence's work as a blues musician. ,http://www.davisenterprise.com/files/2016/04/clarence-van-hookW-1024x818.jpg,https://www.youtube.com/watch?v=NJIORhJ-NXY,,http://content.postnewsgroup.com/2011/11/meeting-clarence-van-hook-a-living-treasure/,Musical; blues,3E,,,
Rose,Artie,Artie Rose,,,,,,"Artie Rose was a mandolinist who specialized in folk music. He played with the Old Reliable String Band, which made a record under Smithsonian Folkways, as well as The Folk Stringers. ",Berkeley folk music enthusiasts probably followed Rose's work on the mandolin. ,,https://www.youtube.com/watch?v=z90LNYAVMEk,Barry Kornfeld; Danny Kalb,https://www.discogs.com/artist/1927056-Artie-Rose,Musical; folk,3E,,,
Moore,Carl,Carl Moore,1/19/1905,2/12/1985,"Paragould, AR","Huntington Beach, CA","Fayetteville, AR; Chicago, IL; Los Angeles, CA","Carl Lee Moore, popularly known as Deacon Moore or ""Squeakin' Deacon,"" was a drummer and radio emcee famous for his presence on Los Angeles AM radio country music stations. He was one of the most famous folk music disk jockeys in the 1950s and 1960s.","Berkeley residents likely knew of Moore's work as a drummer and/or disc jockey, and they might have heard his show, though it was based in Los Angeles.",http://2.bp.blogspot.com/-ZaCQPzFqCN0/UN9PInMWiHI/AAAAAAAABNU/yQBh_HCqIEM/s1600/Carl+Moore+from+Cecil+Warren+10x12x72.jpg,,,http://www.hillbilly-music.com/dj/story/index.php?id=13268,Radio; musical; country; folk,3E,,,The source I found is very thorough. 
Herald,John,John Herald,9/6/1939,7/18/2005,"New York, NY","West Hurley, NY",,"John Herald was a bluegrass and folk musician who played the guitar and sang. He is best known for being a founding member of the Greenbriar Boys, one of the most popular folk trios of the 1960s and a popular band within the Greenwich Village folk music scene. ","The Greenbriar Boys performed at the Berkeley Folk Music Festival, and they were a popular folk music band in the 1960s.",http://www.johnherald.com/john_h400.jpg,https://www.youtube.com/watch?v=wsjUzXDYEBc,Pete Seeger; Woody Guthrie; Bob Dylan; Paul Prestopino; Ralph Rinzler; Joan Baez,https://en.wikipedia.org/wiki/John_Herald,Musical; bluegrass; country,3E; 4E,,,
Cole,Duane,Duane Cole,4/1/1914,2/3/2004,"Toulon, IL","Burleson, TX",,"Duane Cole was an aerobatic pilot who performed several airshows in the 1940s, 50s, and 60s. He left the air show business after his son was killed during practice for an airshow, but then pursued a career in air races in the 1960s and 1970s.","Cole was famous for his airshows in the 1950s and 60s, and Berkeley residents might have seen his shows when he ventured to California. ",https://s3-us-west-2.amazonaws.com/find-a-grave-prod/photos/2014/307/8360028_1415144994.jpg,https://www.youtube.com/watch?v=YE9ovisH5iU,,https://en.wikipedia.org/wiki/Duane_Cole,Personality,3E; 4E,,,
Bouterse,Curt,Curt Bouterse,1942?,,"Carlisle, KY",,"Naples, Italy; Berkeley, CA; San Diego, CA; Pensacola, FL",Curt Bouterse is a banjo player and ethnomusicologist who lived in Los Angeles and San Diego for a number of years. He has taught at several universities and conducted fieldwork on ethnomusicologist in various countries. ,"Both Curt and his sister, Lee, were known for their work in folk music. Curt did not begin studying ethnomusicology until the 1980s, but he was active in the West Coast folk music scene and organized the San Diego Folk Music Festival. ",http://home.earthlink.net/~curtis.carlisle.bouterse/sitebuildercontent/sitebuilderpictures/lilgourdie.jpg,https://www.youtube.com/watch?v=vnR9bBe769M,Lee Bouterse,http://home.earthlink.net/~curt_bouterse/id4.html,Local; musical; folk,4E,,,"There is a LOT going on on this guy's website. His bio goes over everything from his academic career to his love life! He even references Humbead's map--quote: ""Those who weren't on the West Coast in the 60's may never have heard the name Humbead and traveling that road is perhaps beyond the purview of this site. Suffice it to say that both my sister Lee and I were included in the in-joke List of Population for their Revised Map of the World. For the 1968-9 List my name is next to Don Stover and Lee is next to Arlo Guthrie. Reading the List of names is both a nostalgic and psychedelic experience."" ""Nostalgic and psychedelic experience"" is such a great quote! He might be a good person to reach out to!"
Atchley,Sue,Sue Atchley,,,,,,,,,,,,,4E,,,
Suzuki,Daisetz,Daisetz T. Suzuki,10/18/1870,7/12/1966,"Honda-Machi, Japan","Kamakura, Japan","Tokyo, Japan; London, United Kingdom; New York, NY","Daisetsu Tataro Suzuki was a Japanese author who wrote books and essays on Buddhism, Zen, and Shin. His writings were instrumental in spreading knowledge of Zen and Shin to the West, and he spent several years lecturing at American and European universities. He was nominated for a Nobel Peace Prize in 1963.","Berkeley intellectuals likely followed Suzuki's work, especially as Eastern philosophy became popular in the 1960s.",https://lareviewofbooks-org-cgwbfgl6lklqqj3f4t3.netdna-ssl.com/wp-content/uploads/2015/02/Suzuki-DT.jpg,https://www.youtube.com/watch?v=5ZJ7nKKNfOA,,https://en.wikipedia.org/wiki/D._T._Suzuki,Literary; academic; philosophical; religious,1C,,,"D.T. Suzuki is also listed in Quadrant 1C! But he is listed as ""D.T."" there, and ""Daisetz T."" here. Wikipedia spells his name ""Daisetsu,"" but transcribing Eastern languages to the Latin alphabet is never exact. "
du Shane,Mary,Mary du Shane,,,"Rochester, MN",,"Minneapolis, MN","Mary Dushane is a fiddler who has played with several folk bands. She played at the grand opening of the New Riverside Cafe, a Minneapolis cafe known for being a center of radical politics, and she has continued to play in old-time string bands and jug bands ever since. ","While it is uncertain if DuShane every ventured out to Berkeley, and she got her start playing with Butch Waller of the famous San Francisco bluegrass group High Country. Therefore, she might have been recognized by Berkeley folk music enthusiasts. ",http://www.lizlyle.lofgrens.org/BrnSnift/MaryD88.jpg,https://www.youtube.com/watch?v=qsj6aQHkgT0,Butch Waller; Doc Watson,http://www.marydushane.com/index.php/bio,Musical; folk,4E,,,"While the map lists her last name as ""du Shane,"" she spells it ""DuShane"" on her website. "
Hurewitz,Barbar,Barbara Hurewitz,,,,,,,,,,,,,4E,,,
Corbett,Jerry,Jerry Corbett,1/7/1943,3/8/2014,"Tifton, GA","Smiley, TX","Boston, MA; New York, NY; San Francisco, CA",Jerry Corbitt was a musician who played the guitar and the harmonica best known for being a founding member for the rock band The Youngbloods along with Jesse Colin Young. He left the Youngbloods in 1969 and pursued a solo career in the 1960s and 1970s.,"Corbitt got his start playing folk music, and the Youngbloods performed at the Berkeley Folk Music Festival. Therefore, Berkeley folk music enthusiasts probably listened to his work. ",https://s3-us-west-2.amazonaws.com/find-a-grave-prod/photos/2014/70/126222761_1394673110.jpg,https://www.youtube.com/watch?v=JbRvXhyFmZY,Jesse Colin Young; Joe Bauer; Banana,https://en.wikipedia.org/wiki/Jerry_Corbitt,Musical; folk; rock,4E,,,"The map lists his name as ""Corbett,"" but his name is actually ""Corbitt."" Also--I just realized that ""Banana"" (on the map) is Lowell Levinger, a member of the Youngbloods!"
Schumann,Bill,Bill Schumann,,,,,,Bill Schumann is a cellist who plays jazz and swing music. He has had a long career since the 1950s. ,Berkeley jazz and swing enthusiasts probably listened to Schumann's work on the cello. ,,,,https://www.discogs.com/artist/357490-Bill-Schumann,Musical; jazz,4E,,,
Bamford,Jim,Jim Bamford,,,,,"San Francisco, CA",Jim Bamford was a folk guitar player who played with Dr. Humbead's New Tranquillity String Band and Medicine Show.,"Dr. Humbead's New Tranquility String Band performed at the Berkeley Folk Music Festival, and so Berkeley residents likely knew of Bamford's music. ",,,Sue Draheim; Mac Benford; Bill Spires,http://www.deaddisc.com/GDFD_NorCal_H.htm,Musical; folk; local,4E,,,
