Last_name,First_name,Full_name,Date_birth,Date_death,Place_birth,Place_death,Other_places_lived,Biography,Relation to Berkeley Folk Scene/Music Festival/Humbead's Map,Picture,Other media,Related people (semicolon delimited),Source,Type_of_figure,Quadrant_location,Locations_of_person,Wikipedia,Other_notes
Seuss,Dr.,Dr. Seuss,3/2/1904,9/24/1991,"Springfield, MA","La Jolla, CA","Oxford, United Kingdom; Los Angeles, CA; New York, NY","Theodor Seuss Geisel, who used the pen name Dr. Seuss, was an American writer, illustrator, and animator most famous for his children's books including The Cat in the Hat, Green Eggs and Ham, and How the Grinch Stole Christmas! Dr. Seuss's books remain some of the most popular children's books in America.","Dr. Seuss drew many popular political cartoons during World War II, most of which displayed his leftist views that Berkeley residents probably identified with. In addition, most of Dr. Seuss's most famous children's books were published in the 1950s and 1960s.",https://static1.squarespace.com/static/519aaaafe4b0d48b4bf8759a/519aab0fe4b09c275e87f797/519aab0fe4b09c275e87f799/1369090848272/Ted_HeadshotBIG.jpg,https://www.youtube.com/watch?v=2KRkR8HaR9c,,https://en.wikipedia.org/wiki/Dr._Seuss,Literary,1A,,,
Novelli,Jim,Jim Novelli,,,,,,,,,,,,,1A,,,
Ragu,,Ragu,,,,,,"""America's Favorite Pasta Sauce Brand.""",,http://groceries.iceland.co.uk/medias/sys_master/root/hd6/h1b/8830686265374.jpg,https://youtu.be/6mzEYN51Xv0?t=12s,,https://en.wikipedia.org/wiki/Rag%C3%BA,Culinary,1A,,,
Evans,Mal,Mal Evans,5/27/1935,1/5/1976,"Liverpool, United Kingdom","Los Angeles, CA",,"Mal Evans was the road manager for the Beatles until the band broke up in 1970s. He contributed to some recordings and appeared in four out of five of the Beatles' films. He was killed in a bizarre police confrontation in 1976, and none of the four members of the Beatles attended his funeral.",Evans likely accompanied the Beatles when they toured in the Bay Area. ,http://beatlephotoblog.com/photos/2013/09/11.jpg1.jpg,,Paul McCartney; John Lennon; George Harrison,https://en.wikipedia.org/wiki/Mal_Evans,Musical; rock; psychedelic; Beatles,1A,,,
,,R. Anthony Holder,,,,,,,,,,,,,1A,,,
Traum,Happy,Happy Traum,5/8/1938,,"New York, NY",,,"Happy Traum is an American folk musician who was a stalwart of the Greenwich Village folk music scene in the 1960s, where he often collaborated with singers like Bob Dylan and Pete Seeger. He and his brother, Artie Traum, performed as a duo and released some popular folk music records in the late 1960s and early 1970s. He participated in the Woodstock music scene in the 1970s and 1980s, and he continues to play and record today.","Happy Traum likely ventured to Berkeley while on tour, and he was active in the 1960s folk music scene as a whole.",http://www.edgallucciphotography.com/site/wp-content/gallery/happy-and-artie-traum/2-ha_f1y.jpg,https://www.youtube.com/watch?v=spsSyIx5rkA,Bob Dylan; Pete Seeger; Phil Ochs,https://en.wikipedia.org/wiki/Happy_Traum,Musical; folk,1A,,,Pictured with Artie Traum.
Arnold,Steve,Steve Arnold,,,,,,,,,,,,,1A,,,
Berkeley,Roy,Roy Berkeley,6/2/1935,4/24/2009,"New York, NY","Bennington, VT",,"Roy G. Berkeley was a folk musician and historian who was active in the Greenwich Village folk music scene in the 1950s and 1960s. Like other folk musicians Berkeley was a leftist political activist, though he apparently became a conservative later in life. He was one of the first folk musicians to perform at The Gaslight, made an album for Folkways Records as a member of the Old Reliable String Band in 1962, he wrote a parody of The People's Songbook called The Bosses' Songbook. ","Roy Berkeley probably was not involved in the Berkeley folk music scene. However, due to his participation in both the folk music scene and academia (he had lectured and completed research at universities like The New School and Wesleyan) his inclusion in the map makes perfect sense. ",http://e.snmc.io/lk/f/a/2915e779173b1ab9b518f580d7fdb164/4262116.jpg,,Pete Seeger; Woody Guthrie,http://www.legacy.com/obituaries/bennington/obituary.aspx?n=roy-g-berkeley&pid=126730579 ; https://pjmedia.com/ronradosh/2009/5/8/roy-berkeley-rip/,Musical; folk; Academic,1A,,,No relation to the university.
Street,Dusty,Dusty Street,1947,,"San Francisco, CA",,"Cleveland, OH; Las Vegas, NV; Seattle, WA","Dusty Street was a DJ for San Francisco's KMPX radio station in the late 1960s, and she continued to involve herself in the Bay Area FM radio music scene through the rest of the 1960s and 1970s. She was one of the first woman DJ's to play the airwaves in San Francisco.",Residents of Berkeley likely listened to Street's radio station,http://www.helenrosemarketti.com/wp-content/uploads/2009/09/2009_09-September_Street.pdf,https://www.youtube.com/watch?v=f0ZUOc-bqiI,,http://www.helenrosemarketti.com/wp-content/uploads/2009/09/2009_09-September_Street.pdf,Musical; radio; local,1A,,,
Curtis,Gayle,Gayle Curtis,,,,,,,,,,,,,1A,,,
Richmond,Fritz,Fritz Richmond,7/10/1939,11/20/2005,"Newton, MA","Portland, OR","Boston, MA; Los Angeles, CA",Fritz Richmond was an American folk musician and recording engineer who was famous for playing both the washtub bass and the jug. He contributed to recordings by artists like Norman Greenbaum and The Grateful Dead.,"Fritz Richmond was active in the folk music scenes on both the East Coast and the West Coast. In addition, he is often credited with being the first to wear ""granny glasses,"" a popular counterculture accessory  adopted by West Coast bands like The Doors and Big Brother and the Holding Company. ",http://www.cookephoto.com/images/63-12-c23.jpg,https://www.youtube.com/watch?v=0Kn0Qhc49Js,Janis Joplin; Jim Kweskin,https://en.wikipedia.org/wiki/Fritz_Richmond,Musical; folk,1A,,,See Richmond speaking at 2:17 in YouTube video.
,,Steve Landes,,,,,,,,,,,,,1A,,,
Francis,John,John Francis,,,,,,Not sure if this is the environmentalist? ,,,,,,,1A,,,
Peterson,Gary,Gary Peterson,,,,,,Gary Peterson is a very common name so this is a hard one to figure out. This might be the guy [https://www.linkedin.com/in/gary-peterson-31b49329] but still not sure. ,,,,,,,1A,,,
Rignall,Ruth,Ruth Rignall,,,,,,,,,,,,,1A,,,
Friend,Cynthia,Cynthia Friend,,,,,,,,,,,,,1A,,,
Emerson,Bill,Bill Emerson,1/22/1938,,"Washington, D.C.",,,"Bill Emerson is a five-string banjo player who was a member of bluegrass bands like Buzz Busby and The Bayou Boys and The Country Gentlemen. He was active in the bluegrass scene of the 1960s and the 1970s, and in the 1970s he joined the United States Navy Band to play with the bluegrass ensemble.","Bluegrass was a popular music genre of the folk music revival, so Berkeley bluegrass enthusiasts likely knew of Emerson. ",http://cps-static.rovicorp.com/3/JPG_500/MI0002/267/MI0002267450.jpg?partner=allrovi.com,,,https://en.wikipedia.org/wiki/Bill_Emerson_(musician),Musical; folk; bluegrass,1A,,,
Wohlgemuth,Nutka,Nutka Wohlgemuth,,,,,,,,,,,,,1A,,,
Wright,Chip,Chip Wright,,,,,,According to this website [http://patch.com/california/sanrafael/folk-music-hootenanny-and-pete-seeger-tribute_21b8c5cb] it seems like Chip Wright was a pastor who participated in the 1960s hotenanny tradition. Perhaps he works/ed at a church in California?,,,,,,,1A,,,According to this website [http://patch.com/california/sanrafael/folk-music-hootenanny-and-pete-seeger-tribute_21b8c5cb] it seems like Chip Wright was a pastor who participated in the 1960s hotenanny tradition. Perhaps he works/ed at a church in California?
Carter,Maybelle,Maybelle Carter,5/10/1909,10/23/1978,"Nickelsville, VA","Hendersonville, TN","Nashville, TN","Maybelle Carter was a country musician and member of the Carter Family, a music act that performed primarily in the 1920s and 1930s. She played the guitar, the autoharp, and the banjo, and she continued to perform well into the 1950s and 1960s with her daughters. She is particularly remembered for her signature ""Carter Scratch"" style of guitar playing. She was a darling of the mid-twentieth century country music scene and was inducted into the Country Music Hall of Fame in 1970.","While it is unclear if Maybelle Carter ever performed in Berkeley, her rural country music style was popular among folk music enthusiasts of the 1960s.",http://farm3.static.flickr.com/2135/5704230875_2abd455d2e_o.jpg,https://www.youtube.com/watch?v=XE80Ed59uCY,,https://en.wikipedia.org/wiki/Maybelle_Carter,Musical; country,1A,,,
Lundberg ,Deirdre,Deirdre Lundberg,,,,,"Berkeley, CA","Deirdre Lundberg and her husband Jon owned Fretted Instruments, a vintage guitar shop, which was frequented by those involved in the Berkeley folk music scene. ","The Lundbergs were friends of Barry Olivier, and they were heavily involved in the folk music scene in Berkeley in the 1960s and 1970s. They even performed at the Berkeley Folk Music Festival. ",,,Barry Olivier; Jon Lundberg,https://www.fretboardjournal.com/features/obituary-guitar-dealer-jon-lundberg/,Musical; folk; local,1A,,,
Carlson,Polly,Polly Carlson,,,,,,,,,,,,,1A,,,
Holder,Tony,Tony Holder,,,,,,,,,,,,,1A,,,
Reed,Jimmy,Jimmy Reed,9/6/1925,8/29/1976,"Dunleith, MS","Oakland, CA","Chicago, IL; Gary IN","Jimmy Reed was a blues musician and songwriter, who had a significant impact on rock and roll artists like Elvis Presley, Eric Clapton, and the Rolling Stones. Many of his biggest hits, like ""Big Boss Man,"" ""Bright Lights, Big City,"" and ""Ain't That Lovin' You Baby,"" have been covered numerous times by rock and roll musicians. However, due to his epilepsy caused by severe alcoholism and other personal problems, he never achieved the same level of fame of other famous blues artists.","Reed was heavily involved in the blues scene of the 1950s, and he continued to play in the 1960s in spite of his health problems. Therefore, blues enthusiasts in Berkeley were most likely familiar with his songs.",https://www.biography.com/.image/t_share/MTE1ODA0OTcxMzY3NDk5Mjc3/jimmy-reed-40889-1-402.jpg,https://www.youtube.com/watch?v=BhRZha7ULWg,,https://en.wikipedia.org/wiki/Jimmy_Reed,Musical; blues,1A,,,
Katz,Michael,Michael Katz,,,,,,,,,,,,,1A,,,There are a lot of Michael Katz's out there. Perhaps he is this blog post writer: [https://irom.wordpress.com/2012/03/09/katz-of-the-day-reflections-on-mountain-dew/]. He reviews jazz and folk music and seems to be at the right age to be in college in the 1960s. Otherwise I'm stumped.
Duren,Antonia,Antonia Duren,,,,,"New York, NY","Antonia Duren was a folk singer and songwriter who played in psychedelic folk bands like The Holy Modal Rounders and The Moray Eels along with her husband, Peter Stampfel. These bands attracted a cult following that lasted well into the twentieth century. She was heavily involved in the Greenwich Village folk music of the 1960s.",Duren's bands' psychedelic folk sound was likely popular among Berkeley folk music enthusiasts in the 1960s.,,https://www.youtube.com/watch?v=MbNYElGZ5qE,Steve Weber,https://books.google.com/books?id=7ctjc6UWCm4C&pg=PT510&lpg=PT510&dq=antonia+duren&source=bl&ots=YErfGjXLC5&sig=ypnUDuoz5Vy9N57z4N2K23Bn2K4&hl=en&sa=X&ved=0ahUKEwjKwNvPx__SAhVE5GMKHVk1DFcQ6AEINTAF#v=onepage&q=antonia%20duren&f=false ; https://en.wikipedia.org/wiki/The_Holy_Modal_Rounders,Musical; psychedelic; rock,1A,,,"I gathered this information from a Wikipedia page of the Holy Modal Rounders and the book A Rough Guide to Rock. I included the Easy Rider video because she is credited in this song, apparently. However, the information is incomplete. "
,,David Armintrout,,,,,,,,,,,,,1A,,,
Siggins,Bob,Bob Siggins,,,Oklahoma,,"Boston, MA","Bob Siggins was a banjo player for the Charles River Valley Boys, an American bluegrass group comprised of Harvard and MIT students. He and his wife Betsy were heavily involved in the Boston folk music scene of the 1950s and 1960s.","Siggins' band, the Charles River Valley Boys, performed at the Berkeley Folk Music Festival several times.",http://www.bu.edu/cas/magazine/fall12/kwait/kwait-img3.jpg,https://www.youtube.com/watch?v=2j4NgeLDtT4,Joan Baez,https://en.wikipedia.org/wiki/Charles_River_Valley_Boys http://www.cambridgehistory.org/discover/music/Siggins/Betsy_Sigginstext.html,Musical; bluegrass,1A,,,"Used Wikipedia article and interview with wife to piece his story together. Look at the picture of him at the back of Dylan's motorcycle! Source says this is a picture of Dylan ""before he was Dylan."""
Mangan,Bruce,Bruce Mangan,,,,,,,,,,,,,1A,,,"I found a Bruce Mangan who is a professor at Berkeley, but he did not get his PhD until 1991 so it's probably the wrong one. "
Kindred,Lisa,Lisa Kindred,1942?,,"Buffalo, NY",,"San Francisco, CA; New York, NY; Boston, MA","Lisa Kindred is a folk and blues singer who was involved in the Greenwich Village folk music scene in the 1960s. She released two albums and moved to southern California in the late 1960s. Later, she became a fixture in the San Francisco bar scene. She continues to perform today.","While Kindred did not move to the Bay Area until well after the Berkeley Folk Music Festival ended, her music was likely popular among Berkeley folk music enthusiasts.",https://www.wirz.de/music/kindred/grafik/ilikeit4.jpg,https://www.youtube.com/watch?v=Zr9jxXowIVY,,https://en.wikipedia.org/wiki/Lisa_Kindred http://www.marinij.com/article/zz/20130201/NEWS/130209240,Musical; folk; blues,1A,,,I used a Wikipedia article and an interview.
Moon,Heath,Heath Moon,,,,,,,,,,,,,1A,,,
Mainer,Joseph Emmett,J.E. Mainer,7/20/1898,6/12/1971,"Weaverville, NC",,"Charlotte, NC","J.E. Mainer was  a fiddle player who performed in several bluegrass groups including Crazy Water Crystals and The Mountaineers in the 1930s and 1940s. The Mountaineers were rediscovered during the folk revival of the 1960s, and so Mainer continued to play until his death in 1971.","Mainer performed along with The Mountaineers at the Berkeley Folk Music Festival. In addition, his bluegrass music directly influenced the folk music revival of the 1960s. ",http://www.lizlyle.lofgrens.org/BrnSnift/Mainer.jpg,https://www.youtube.com/watch?v=UmXSOPDe5-Y,, https://en.wikipedia.org/wiki/J._E._Mainer http://www.cmt.com/artists/je-mainer/biography/,Musical; bluegrass; folk,1A,,,
Ekstrom,Ale,Ale Ekstrom,1937?,7/22/2015,Colorado,"San Francisco, CA","Sausalito, CA","Ale Ekstrom was a leader in the Sausalito anchor-outs, a resistance movement in the 1960s and 1970s where several people anchored houseboats to prevent developers from building a marina that would gentrify the area. He was a Navy veteran and an amateur folk music performer.","Ekstrom was a minor celebrity due to his involvement in the ""houseboat wars,"" and he was a folk musician who performed at various venues around the Bay Area. He lived in an old Navy vessel anchored in Sausalito for more than fifty years.",http://www.mercurynews.com/wp-content/uploads/2016/08/20150728__nmij0819anchor7.jpg?w=620,https://www.youtube.com/watch?v=tkAOoiZd8s4,,http://www.mercurynews.com/2015/07/28/ale-ekstrom-iconic-salt-of-richardson-bay-dies-at-78/,Musical; folk; local,1A,,,This is a crazy story. YouTube video is worth watching.
Ferlinghetti,Lawrence,Lawrence Ferlinghetti,3/24/1919,,"Yonkers, NY",,"New York, NY; Paris, France; San Francisco, CA","Lawrence Ferlinghetti was a poet, painter, and liberal activist who associated with the Beat Movement. His publishing company, City Lights Booksellers and Publishers, published books by authors like Noam Chomsky, Charles Bukowski, and Allen Ginsberg. He was arrested in 1956 for publishing Howl, and stood trial in a highly publicized case in front of the San Francisco Municipal Court that resulted in his acquittal. ","Ferlinghetti is a literary celebrity, and he was particularly famous in the 1960s in the wake of the publishing of Howl. ",https://static01.nyt.com/images/2012/01/21/sports/POET/POET-popup.jpg,https://www.youtube.com/watch?v=lKCblAJtzgE,Allen Ginsberg,https://en.wikipedia.org/wiki/Lawrence_Ferlinghetti,Literary; local,1A,,,
Monroe,James W.,James W. Monroe,,,,,,,,,,,,,1A,,,Might be a member of the The Bluegrass Boys but not sure.
Frances,Paul,Paul Frances,,,,,,,,,,,,,1A,,,"Might actually be spelled ""Paul Frakes."" Either way, I can't find a Paul Frances or a Paul Frakes."
Boise,Ron,Ron Boise,12/22/1931,5/26/1966,"Brush, CO","Santa Cruz, CA","San Francisco, CA","Ron Boise was a sculptor who worked primarily with sheet metal to make large, abstract figures. He is most famous for being put to trial in 1964 for creating an exhibition of sculptures engaged in sexual unions illustrated in the Kama Sutra. While he was found not guilty in the trial, he died only two years later in 1966 at the age of 34.",Boise's obscenity trials made him a minor celebrity in the Bay Area.,http://boiselifeworks.info/BoiseGoodPhotos/Ron%20with%20Self-portrait2.jpg,https://www.youtube.com/watch?v=3hoxDFgphXw,,http://boiselifeworks.info/,Visual arts; local,1A,,,
White,Eric,Eric White,,,,,,,,,,,,,1A,,,"There are a couple of famous Eric Whites out there. This might be Eric White Sr. or Jr. Sr. was the father of the White Brothers, a bluegrass band that was popular in the 1950s and 1960s. I am not sure."
Davis,Carole,Carole Davis,,,,,"Berkeley, CA",Carole Davis (now Carole Kennerly) served as city council member and Vice Mayor of Berkeley in the 1960s and 1970s. She remains involved in local politics today.,Kennerly must have been a well-known figure among Berkeley residents.,http://www.berkeleydailyplanet.com/photos/03-16-11/wom-1.jpg,,,http://www.berkeleydailyplanet.com/issue/2011-03-16/article/37517,Political; local,1A,,,This is all the information I could find. I think it is the right Carole Davis.
McCartney,Paul,Paul McCartney,6/18/1942,,"Liverpool, United Kingdom",,"Los Angeles, CA; London, United Kingdom","Paul McCartney was arguably the most famous member of the Beatles, and he continues to perform today. He has involved himself in activist movements such as animal rights and music education throughout his life.","The Beatles ventured into the Bay Area several times while on tour. Incidentally, they broke up the same year that the Berkeley Folk Music Festival ended, 1970.",http://dehayf5mhw1h7.cloudfront.net/wp-content/uploads/sites/83/2015/09/23082302/paulmccartney-662x400.png,https://www.youtube.com/watch?v=CtnXnWpC9GE,George Harrison; John Lennon,https://en.wikipedia.org/wiki/Paul_McCartney,Musical; rock; psychedelic; Beatles,1A,,,
Pomeroy,Doug,Doug Pomeroy,,,,,"Los Angeles, CA; New York, NY","Doug Pomeroy is a sound engineer who specializes in audio restoration. He was a Columbia Records staff recording engineer from 1969 to 1975. He has helped restore some famous jazz recordings from the 1930s (the ""pre-LP"" era).","Because Pomeroy worked as a sound engineer for Columbia Records in the late 1960s and early 1970s, he probably was well-known in the music world. In addition, his work on jazz records probably made him famous among some folk music circles.",http://www.audioxpress.com/assets/upload/images/Pomeroy-300x267.jpg,https://www.youtube.com/watch?v=dIrFJj_f3i8,,http://www.audioxpress.com/article/member-profile-doug-pomeroy http://www.nycommunitytrust.org/GrantSeekers/GrantsatWork/EducationArtsandHumanJustice/JazzGreatsasTheyWereMeanttoBeHeard/tabid/611/Default.aspx ,Musical; jazz,1A,,,
Elder,Bill,Bill Elder,,,,,,,,,,,,,1A,,,
,,Bob Oliver,,,,,,,,,,,,,1A,,,"There are a couple of Bob Olivers out there (a Berkeley professor emeritus) that could fit the bill, but it's a common name so I'm not sure."
McReynolds,Jim,Jim McReynolds,2/13/1927,12/31/2002,"Coeburn, VA",,"Valdosta, GA","Jim McReynolds was a member of the bluegrass duo Jim and Jesse, along with his brother Jesse McReynolds. They rose to fame in the 1950s, and they continued to play until Jim's death in 2002.",Jim and Jesse was one of the most popular bluegrass groups in the 1960s.,https://static1.squarespace.com/static/540e6e18e4b0a9fac1c1bd50/t/553fd489e4b0693533cd6156/1430246540172/,https://www.youtube.com/watch?v=NUrhRnh8-no,,https://en.wikipedia.org/wiki/Jim_%26_Jesse,Musical; bluegrass,1A,,,
Albin,Rodney,Rodney Albin,7/4/1940,5/30/1984,"San Francisco, CA","San Francisco, CA",,"Rodney Albin was a folk musician who was heavily involved in the Bay Area folk music scene in the 1960s. He specialized in hand crafting instruments, and he built instruments for musicians like Bill Graham and Carlos Santana. He sometimes played with Big Brother and the Holding Company.","Rodney Albin was clearly well-integrated into the Bay Area folk music scene, and he socialized with up and coming figures like Janis Joplin and Jerry Garcia. ",https://ponderingpig.files.wordpress.com/2008/09/rod-albin.jpg,,,https://www.findagrave.com/cgi-bin/fg.cgi?page=gr&GRid=91819954,Musical; folk; local,1A,,,
Burns,Wally,Wally Burns,,,,,,,,,,,,,1A,,,
Smith,Oliver,Oliver Smith,2/13/1918,1/23/1994,"Waupun, WI","New York, NY",,"Oliver Smith was a famous set designer who designed several Broadway musicals and musical films, including Guys and Dolls, Oklahoma!, and West Side Story. He was nominated for twenty-five Tony Awards throughout his career.",Smith was a famous artistic figure in the 1950s and 1960s.,https://2.bp.blogspot.com/-OSVw7M8mCW0/Vy0QP6f6JuI/AAAAAAAACEk/ypaonk8nRIQTzg7ShSjcjSxar_9n5cDBwCLcB/s640/588459197.jpg,https://www.youtube.com/watch?v=N_T9_iwAlD0,,https://en.wikipedia.org/wiki/Oliver_Smith_(designer),Musical; musical theater; Visual arts,1A,,,"I'm not sure if this is the right Oliver Smith--it's a common name. The YouTube clip is from Guys and Dolls, one of the most famous musicals Smith worked on. "
Magritte,Rene,Rene Magritte,11/21/1898,8/15/1967,"Lessines, Belgium",Brussels. Belgium,"New York, NY","Rene Magritte was a Belgian surrealist artist who was well known for making witty and provocative images. He is credited for influencing artists like Andy Warhol and Jasper Johns, as well as art genres such as pop art and minimalism. ","Magritte's artwork was highly influential in the postwar period, and Berkeley intellectuals were likely familiar with his work. ",http://larissacapoen.weebly.com/uploads/1/4/3/3/14335292/9720208_orig.jpg?0,https://www.youtube.com/watch?v=DRlpD-iEnMQ,Salvador Dali,https://en.wikipedia.org/wiki/Ren%C3%A9_Magritte,Aristic,1A,,,
,,Manny Shaw,,,,,,,,,,,,,1A,,,
Lowinger,Gene,Gene Lowinger,,,"New York, NY",,"New York, NY","Gene Lowinger was a fiddler who joined Bill Monroe's Bluegrass Boys in the 1960s. Hailing from New York, Lowinger was a role model for many urban folk enthusiasts who partook in the bluegrass revival of the 1960s and 1970s. He took up photojournalism in the 1970s and continues to work as a photographer today. In 2009, he wrote a memoir about his experiences touring with Monroe, I hear a Voice Calling: A Bluegrass Memoir. ","Bill Monroe performed at the Berkeley Folk Music Festival, so Lowinger likely accompanied him there. In addition, as an urban bluegrass enthusiast, Lowinger likely inspired many Berkeley inhabitants to follow this music revival.",http://www.press.uillinois.edu/books/images/9780252076633.jpg,https://www.youtube.com/watch?v=qM8KRyV7Ysg,Bill Monroe,http://www.fiddle.com/Articles.page?ArticleID=18540&Index=21,Musical; bluegrass,1A,,,"Lowinger is an interesting character. His transition from musician to photojournalist, as well as his participation in the bluegrass revival as a New Yorker, makes him an interesting figure to study. "
Marvin,Ken,Ken Marvin,6/27/1924,10/16/1991,"Cordova, AL","Cookeville, TN","Nashville, TN","Ken Marvin is the name that Grand Ole Opry performer Lloyd George adopted in the 1950s. In the 1940s, George performed as Lonzo in the comedy act ""Lonzo and Oscar"" along with Rollin Sullivan, who played Oscar. In the 1950s, he began performing traditional country songs and he made several recordings. In the 1960s, he quit performing and began to manage bluegrass performer Bill Monroe.",Marvin/George was a fixture in the country music scene of the mid twentieth century. ,http://www.freestateofwinston.org/lonzoandoscar.htm,https://www.youtube.com/watch?v=GuiT2lApRrA,Bill Monroe,http://www.freestateofwinston.org/lonzoandoscar.htm,"Musical; comedic, bluegrass; country",1A,,,
Smith,Tony,Tony Smith,9/23/1912,12/26/1980,"South Orange, NJ","South Orange, NJ","New York, NY","Tony Smith was a sculptor, architect, and art theorist who is often remembered as a major figure in American Minimalist sculpture and one of the most important sculptors of 1950s and 1960s. His distinctive large, geometric sculptures made him well known in the mid twentieth century.",Smith's work was probably well known by Berkeley intellectuals. ,https://static01.nyt.com/images/2012/08/05/arts/05smith/05smith-blog480.jpg,https://www.youtube.com/watch?v=iSgNDJQt9w4,,https://en.wikipedia.org/wiki/Tony_Smith_(sculptor),Visual arts,1A,,,
Shefflin,Joel,Joel Shefflin,,,,,,,,,,,,,1A,,,
Lee,Christopher,Christopher Lee,5/27/1922,6/7/2015,"London, United Kingdom","London, United Kingdom","Los Angeles, CA","Christopher Lee was a British actor famous for his roles in films like Dracula (1958), The Wicker Man (1973), and the Lord of the Rings trilogy. While in the 1950s he was famous for playing villain figures like Count Dracula, he took a variety of roles in his long career (almost seventy years) and also ventured into singing and writing late in life. ",Lee was already famous by the 1960s for his acting in films like Dracula. ,http://vignette3.wikia.nocookie.net/lotr/images/c/cd/Sir_Christopher_Lee.jpg/revision/latest?cb=20130119110914,https://www.youtube.com/watch?v=ssvgMHCa45s,Laurence Olivier; Peter Cushing,https://en.wikipedia.org/wiki/Christopher_Lee,Cinematic,1A,,,I didn't know that Christopher Lee served in WWII.
Hines,Jay,Jay Hines,,,,,,,,,,,,,1A,,,
