Eckbo,Marilyn,Marilyn Eckbo,,,"San Francisco, CA",,,"Marilyn Eckbo (now Kweskin) is the wife of Jim Kweskin of the band Jim Kweskin and the Jug Band. In addition, she was the daughter of Garrett Eckbo, an American landscape architect based in San Francisco who wrote Landscape for Living, a popular landscape architecture book.","Kweskin grew up in the Bay Area. In addition, Jim Kweskin and the Jug Band performed at the Berkeley Folk Music Festival, so she probably ventured to Berkeley in the 1960s for that occasion.",,,,http://www.allmusic.com/artist/jim-kweskin-the-jug-band-mn0000348039; http://www.nytimes.com/2000/06/18/us/garrett-eckbo-is-dead-at-89-pioneer-of-modern-landscape.html,Local; musical; folk,1C; 1D,,,"I had to piece this one together. I know she is the daughter of Garrett Eckbo from the obituary, and I know she is the wife of Jim kweskin from All Music. She must have married Jim later in life, because her maiden name is listed."
Boutwell,Chris,Chris Boutwell,,,,,"San Francisco, CA","Chris Boutwell is a mandolin player and singer who specializes in bluegrass music. He played for High Country, and he continues to play bluegrass music today.","High Country performed at the Berkeley Folk Music Festival, and Boutwell got his start in the West Coast folk music scene. ",http://www.madeintheshadeband.com/images/Chris2016.jpg,https://www.youtube.com/watch?v=ymyX8DEds-k,Butch Waller; Mylos Sonka,http://www.southcarolinaarts.com/folkheritage/2014/boutwell.shtml,Musical; bluegrass,1C; 1D,,,
Schovsky,Steve,Steve Schovsky,,,,,,,,,,,,,1C; 1D,,,
Murphy,Jack,Murph the Surf,1938,,"Los Angeles, CA",,"Crystal River, FL","Jack Roland Murphy, commonly known as ""Murph the Surf,"" is a surfing champion famous for his criminal activity. He was involved in the biggest jewel heist in American history when he helped steal the J.P. Morgan jewel collection from the American Museum of Natural History. He later committed murder while executing another robbery. In prison, he found religion and now visits prisons all over the United States as part of his prison ministry.","""Murph the Surf"" was a celebrity due to his criminal activities in the 1960s.",http://murderpedia.org/male.M/images/murphy_jack_roland/murphy_101.jpg,https://www.youtube.com/watch?v=d0ke-mxoDeU,,https://en.wikipedia.org/wiki/Jack_Roland_Murphy,Personality,1D,,,"Crazy story! Also, I'm not how to categorize minor celebrities like this who weren't in films, television, music, etc."
Barnes,Marshall,Marshall Barnes,,,,,,,,,,,,,1D,,,
,,Bob Verde,,,,,,,,,,,,,1D,,,
,,B.T. Willie,,,,,,,,,,,,,1D,,,
Sartre,Jean Paul,Jean Paul Sartre,6/21/1905,4/15/1980,"Paris, France","Paris, France",,"Jean-Paul Sartre was one of the most famous French philosophers of the twentieth century, and he made important contributions to existentialism and phenomenology. During his lifetime, he maintained a very public persona and participated in several movements and protests.","Sartre had an immense impact on philosophy, critical theory, and other academic disciplines that several residents of Berkeley certainly studied.",https://cdn2.hubspot.net/hub/237126/file-924605479-jpg/sartre-1.jpg,https://www.youtube.com/watch?v=_g8JVK4Fppw,,https://en.wikipedia.org/wiki/Jean-Paul_Sartre,Literary; academic,1D,,,
Cooper,Reed,Reed Cooper,,,,,,,,,,,,,1D,,,"There is a Reed Cooper who went to Berkeley in the 1960s and played instruments. I cannot find any other information on him, hwoever, but here's the website: http://www.tides.org/i-want-to/simplify-amplify-my-personal-philanthropy/make-a-planned-gift/"
Jackson,Shot,Shot Jackson,9/4/1920,1/24/1991,"Wilmington, NC","Nashville, TN",,Shot Jackson was a country guitarist who played Dobro and pedal steel guitar. He was active in the Nashville country music scene in the 1950s and 1960s. ,Berkeley country enthusiasts probably listened to Jackson's work. ,https://images-na.ssl-images-amazon.com/images/I/61uAg7FbMSL.jpg,https://www.youtube.com/watch?v=pQQzdwLRPSA,,https://en.wikipedia.org/wiki/Shot_Jackson,Musical; country,1D,,,"I notice that it is funny that even though Humbead's map physically separates Nashville from everyone else, several Nashville country artists are on this list. "
Brown,Walt,Walt Brown,,,,,,,,,,,,,1D,,,"""Walter Brown"" is a common name, so it is hard to see which one they are referring to. There is a Walter Brown who was an American blues singer, but he stopped recording in the 1950s (https://en.wikipedia.org/wiki/Walter_Brown_(singer)). There's also a racecar driver who went by ""Walt."""
Mazer,Dennis,Dennis Mazer,Sep-41,7-Mar,"Madison, WI","San Francisco, CA","Chicago, IL; New York, NY",Dennis Mazer was an activist and folk music enthusiast who transported underground newspapers and rare import records to San Francisco in the 1960s.,Mazer seems to have been involved in countercultural politics in Berkeley in the 1960s.,http://ak-cache.legacy.net/legacy/images/Cobrands/SFGate/Photos/4979455_041307_7.jpg,,,http://www.legacy.com/obituaries/sfgate/obituary.aspx?n=Dennis-Mazer&pid=87191676,Local; musical; folk,1D,,,All I could find was this obituary.
Schneider,R.E.,R.E. Schneider,,,,,,,,,,,,,1D,,,
Lasser,Greg,Greg Lasser,,,,,,,,,,,,,1D,,,
Cohen,John,John Cohen,8/2/1932,,"New York, New York",,"Hudson Valley, NY; Peru","John Cohen is a member of the New Lost City Ramblers, an old-time string band, as well as a musicologist. Cohen had been involved in the Abstract Expressionist Scene in Greenwich Village in the 1950s before founding the Ramblers, and he continues to play folk music today.","The New Lost City Ramblers participated in the Berkeley Folk Music Festival several times. In addition, Cohen was an important player in the beginnings of the American folk music revival of the 1950s and 1960s.",https://www.loc.gov/concerts/folklife/images/john-cohen.jpg,https://www.youtube.com/watch?v=W7K1sRp6OKw,Bob Dylan; Pete Seeger; Roscoe Holcomb,https://en.wikipedia.org/wiki/John_Cohen_(musician),Musical; folk,1D,,,
Sanders,Mike,Mike Sanders,,,,,,,,,,,,,1D,,,
Hahne,Ron,Ron Hahne,,,,,"New York, NY","Ron Hahne was a member of the Dada-influenced New York art group Black Mask, the precursor to the Up Agains the Wall Mutherfuckers, an anarchist group. Along with Ben Morea, he produced several zines for Black mask.",Berkeley intellectuals interested in anarchist politics and surrealist art might have followed Black Mask. ,,,,http://secure.pmpress.org/index.php?l=product_detail&p=255,Visual arts; literary,1D,,,"Incomplete information, but it is interesting that a group like Black Mask would be referenced in the map. "
Dodd,Bobbi,Bobbi Dodd,,,,,,,,,,,,,1D,,,"I found one comment in a message board that says that Bobbi Dodd was the manager for a girl band in the 1960s called The Unidentified Flying Objects. That's all i found, though. Here's the link to the comment: http://www.garagehangover.com/unidentifiedflyingobjects/"
Steinbach,Carol,Carol Steinbach,,,,,,,,,,,,,1D,,,
Backos,Tom,Tom Backos,,,,,,,,,,,,,1D,,,
Wayne,Jack,Jack Wayne,,,,,,,,,,,,,1D,,,
Price,George,George Price,10/6/1922,1/6/1975,"New York, NY","London, United Kingdom","Chicago, IL; Boston, MA; Minneapolis, MN","George R. Price was a population geneticist famous for creating the Price equation, which describes how a trait or gene changes in frequency over time. The equation can applied in both biology and economics. Late in life, he became depressed by the implications of his equation, converted to Christianity, devoted his life to helping the homeless, and eventually committed suicide in 1975.",Berkeley intellectuals probably followed Price's work as a geneticist. ,https://upload.wikimedia.org/wikipedia/en/thumb/2/20/George_Robert_Price.jpg/220px-George_Robert_Price.jpg,,,https://en.wikipedia.org/wiki/George_R._Price,Scientific; academic,1D,,,"I think this is the right guy, since he created the Price equation in 1967. I think I have heard this story before--it has been romanticized in books and plays. "
Rose,Skip,Skip Rose,,,,,"Berkeley, CA","Skip Rose was a keyboardist for the Berkeley psychedelic band, Notes from the Underground, which takes its name from a Dostoevsky novel. They regularly headlined venues like the Jabberwock and New Orleans House in Berkeley. ",Rose was heavily involved in the Berkeley local music scene. ,,https://www.youtube.com/watch?v=Bss6CBWXzYk,,http://www.allmusic.com/artist/notes-from-the-underground-mn0000456825,Musical; psychedelic; local,1D,,,
Applin,Herb,Herb Applin,,,,,"Boston, MA",Herb Applin was a bluegrass guitarist who played with Joe Val and the New England Bluegrass Boys. ,Bluegrass fans in Berkeley probably listened to Applin's work with the new England Bluegrass Boys.,http://static.wixstatic.com/media/674eb6_798fe7a5110b047b2d3c5ed4f99653c2.gif_srz_489_331_85_22_0.50_1.20_0.00_gif_srz,https://www.youtube.com/watch?v=qEFcsUl_JT0,,https://en.wikipedia.org/wiki/Joe_Val,Musical; bluegrass,1D,,,Applin is second to the right.
Leider,Philip,Philip Leider,1929,,"Oakland, CA",,"Jerusalem, Israel; New York, NY; Los Angeles, CA",Philip Leider is an art critic who served as founding editor of ArtForum until leaving the magazine in 1971. ,Berkeley art enthusiasts probably read Artforum and followed Leider's work. ,,,Max Kozloff; Norman Mailer,http://www.nytimes.com/2000/09/03/arts/art-architecture-an-art-world-figure-re-emerges-unrepentant.html,Visual arts,1D,,,"Was Artforum popular in the 1960s? Also, this NYT interview I found is pretty wacky."
Willoya,William,William Willoya,,,,,,"William Willoya was a Native Alaskan who co wrote the book Warriors of the Rainbow with Vinson Brown. Warriors of the Rainbow, a modern story, has been misrepresented as ancient prophecy and was used by groups like Greenpeace to justify environmental protections. ",Berkeley residents concerned with the environment or interested in Native American cultures might have read Warriors of the Rainbow. ,"https://images-na.ssl-images-amazon.com/images/I/51YRHJ65EGL._SY344_BO1,204,203,200_.jpg",,,https://en.wikipedia.org/wiki/Legend_of_the_Rainbow_Warriors,Literary,1D,,,
Crawford,Don,Don Crawford,,,,,,Don Crawford was a folk musician who released a self-titled LP with Verve Folkways.,Berkeley folk enthusiasts probably listened to Crawford's work. ,https://img.discogs.com/JirsaqWafW3LlT1j5l_5C74InzE=/fit-in/300x300/filters:strip_icc():format(jpeg):mode_rgb():quality(40)/discogs-images/R-6945466-1430104903-6373.jpeg.jpg,https://www.youtube.com/watch?v=KGRKvH8lvsc,,https://www.discogs.com/Don-Crawford-Don-Crawford/release/6945466,Musical; folk,1D,,,All I can find is a profile on Discogs. 
Copeland,John,John Copeland,,,,,,,,,,,,,1D,,,
Martin,Linda,Linda Martin,,,,,,,,,,,,,1D; 1E,,,"There is a woman named Linda Martin who was the lead singer for the Irish band Chips, but she did not joining Chips until 1969 and none of their hits came out until the mid-1970s."
Stewart,Nancy,Nancy Stewart,,,,,,,,,,,,,1D; 1E,,,"There is a woman named Nancy Stewart who was a lifelong resident of Berkeley and participated in various activities (such as leading Bear Trek tours and participating in the Cal Alumni Association), but I'm unsure if she's the right one. (http://www.legacy.com/obituaries/sfgate/obituary.aspx?n=nancy-h-stewart&pid=99070969)"
Gude,David,David Gude,,,,,,David Gude was a folk singer who worked as an audio engineer for Vanguard Records. He helped arrange Joan Baez's song Fare Thee Well. ,Berkeley folk enthusiasts probably listened to Gude's work as a musician and sound engineer. ,http://cps-static.rovicorp.com/3/JPG_500/MI0001/386/MI0001386300.jpg?partner=allrovi.com,,,http://www.allmusic.com/artist/david-gude-mn0000178479/credits; https://www.discogs.com/Greenbriar-Boys-The-Jackie-Washington-Hedy-West-Dave-Gude-New-Folks/release/6727861,Musical; folk,1D; 1E,,,I can't find a lot of information on this guy.
,,Jack Plasky,,,,,,,,,,,,,1D; 1E,,,
,,Mayo Taylor,,,,,,,,,,,,,1D; 1E,,,
,,Dick Chandler,,,,,,,,,,,,,1D; 1E,,,
Cooke,John,John Cooke,10/5/1940,,"New York, NY",,"Jackson Hole, WY","John Cooke is an author and bluegrass musician. He played guitar for the Charles River Valley Boys, a New England bluegrass group famous for their album Beatle Country, which made bluegrass covers of songs by the Beatles. He later served as Janis Joplin's road manager. He has also written many Western fiction novels. He is the son of Alistair Cooke, and the great-grandnephew of Ralph Waldo Emerson. ","The Charles River Valley Boys played at the Berkeley Folk Music Festival, so Cooke certainly ventured to Berkeley for that occasion. In addition, while working as Janis Joplin's road manager, he probably made some stops in the Bay Area. ",http://www.johnbyrnecooke.com/images/oreilly_sml.jpg,https://www.youtube.com/watch?v=RECzxQlPyTc,Janis Joplin,https://en.wikipedia.org/wiki/John_Byrne_Cooke,Musical; bluegrass; Beatles,1D; 1E,,,
Fats,Minnesota,Minnesota Fats,1/19/1913,1/14/1996,"New York, NY","Nashville, TN","Norfolk, VA","""Minnesota Fats"" is a fictional character who appears in Walter Trevis's novel The Hustler, as well as the 1961 film adaptation of the book. In the 1960s, pool hustler Rudolf Wanderone began calling himself ""Minnesota Fats"" and claiming that the character was based on him. While Tevis denied that Wanderone had any relation to the novel, Wanderone capitalized from this association and became a minor celebrity in the 1960s. ","The Hustler was a popular film in the 1960s, and Wanderone became famous after he claimed the name ""Minnesota Fats.""",https://s3-us-west-2.amazonaws.com/find-a-grave-prod/photos/2009/20/10819309_123253941850.jpg,https://www.youtube.com/watch?v=78pYhTK5hFc,,https://en.wikipedia.org/wiki/Rudolf_Wanderone,Personality,1D; 1E,,,This is a crazy story!
Buchanan,Jim,Jim Buchanan,,,North Carolina,"Nashville, TN",,"Jim Buchanan was a bluegrass fiddler who played for the Greenbriar Boys, a New York bluegrass group who worked the Greenwich Village folk music scene. He has also accompanied tracks for artists like Ringo Starr and the Doors. ","The Greenbriar Boys played at the Berkeley Folk Music Festival, and bluegrass fans were probably familiar with Buchanan's work. ",http://e.snmc.io/lk/f/a/89dad74c9716a921e35c5808d8036087/3865677.jpg,https://www.youtube.com/watch?v=30OuDHGtAiM,Ralph Rinzler,https://en.wikipedia.org/wiki/The_Greenbriar_Boys,Musical; bluegrass,1D; 1E,,,
Krogh,Derek,Derek Krogh,,,,,,,,,,,,,1D; 1E,,,
Reese,Ralph,Ralph Reese,5/19/1949,,"New York, NY",,,"Ralph Reese is an artist who has illustrated for books, magazines, and comic books since the 1960s. He is best known for collaborating with Byron Preiss on the ""One Year Affair"" serial in the National Lampoon from 1973 to 1975. He also did work for Marvel Comics and DC Comics.",Another homage to a great illustrator and comic book writer in the 1960s.,,,Wally Wood,https://en.wikipedia.org/wiki/Ralph_Reese,Comic book,1D; 1E,,,
Young,Jim,Jim Young,,,,,,,,,,,,,1D; 1E,,,There is a football player who played for the Vikings in the 1960s named Jim Young. It's a popular name so that's why I was unsure. 
Joans,Ted,Ted Joans,7/4/1928,4/25/2003,"Cairo, IL","Vancouver, Canada","Seattle, WA; Berlin, Germany; New York, NY, Louisville, KY; Paris, France","Ted Joans was a jazz poet and painter known for participating in the Beat Generation and his work in avant-garde poetry and painting. He was deeply involved in Surrealism, and he is famous for his bohemian lifestyle. He had various residences around the world. ","Berkeley intellectuals probably followed Joans's work as a poet and visual artist. In addition, many of his letters with creative individuals like Langston Hughes are housed in the Bancroft Library of UC Berkeley. ",https://s3-us-west-2.amazonaws.com/find-a-grave-prod/photos/2009/179/7433946_124626036861.jpg,https://www.youtube.com/watch?v=iAoxZXYuZvE,Allen Ginsberg; Lawrence Ferlinghetti; Salvador Dali,https://en.wikipedia.org/wiki/Ted_Joans,Literary; Visual arts,1D; 1E,,,
Kopit,Arthur,Arthur Kopit,5/10/1937,,"New York, NY",,"Boston, MA","Arthur Kopit is a playwright and two-time Pulitzer Prize finalist, as well as a three-time Tony Award nominee. While his plays cover a wide range of subjects, they often include a skewering of American popular culture. His play include Wings (1969), Wings (1978), and Nine (1982). ","Berkeley intellectuals and theater enthusiasts probably followed Kopit's work--Indians, one of his most famous plays premiered in 1969.",http://d2hej51cni6o0x.cloudfront.net/images/enotes/8684/authorpic.jpg,https://www.youtube.com/watch?v=aeObfJW_0a8,,https://en.wikipedia.org/wiki/Arthur_Kopit,Theatrical,1D; 1E,,,
Bouterse,Lee,Lee Bouterse,,,Tennessee,,"Berkeley, CA; Naples, Italy; San Diego, CA","Lee Bouterse was a folk musician based in Berkeley. She was the sister of Curt Bouterse, a local archaeologist, ethnomusicologist, and folk musician. ",Bouterse was a local folk music figure in Berkeley. ,,,,https://www.discogs.com/Various-Berkeley-Farms-Oldtime-And-Country-Style-Music-Of-Berkeley/release/4171301,,1D; 1E,,,"It looks like Lee Bouterse was a local folk musician in Berkeley--he has been credited in Berkeley Farms, a Folkways record. This credit on Discogs is all I can find on him, however. "
Parry,Joyce,Joyce Parry,,,,,,,,,,,,,1E,,,
Sheehan,Nancy,Nancy Sheehan,,,,,,,,,,,,,1E,,,
Plymell,Charles,Charles Plymell,4/26/1935,,"Holcomb, KS",,"Lawrence, KS; Wichita, KS","Charles Plymell is an author and publisher known for collaborating with and publishing poets, writers, and artists of the Beat Generation. He was also involved in the underground comix scene, and he printed Zap Comix artists. He has been credited for introducing the music of Bob Dylan to Allen Ginsberg. ",Berkeley intellectuals probably followed Plymell's work as an author and publisher. ,https://media2.fdncms.com/pitch/imager/author-charles-plymell-talks-travel-books-and-listening-to-handel-on-lsd/u/original/4031505/charles_plymell.jpg,https://www.youtube.com/watch?v=nITP0S1Ve8k,Allen Ginsberg; Bob Dylan,https://en.wikipedia.org/wiki/Charles_Plymell,Literary,1E,,,
Banarjee,Nikhil,Nikhil Banarjee,10/14/1931,1/27/1986,"Calcutta, India","Calcutta, India",,"Nikhil Banerjee was an Indian classical satirist known for his virtuosity, and he has been remembered for being one of the leading exponents of the sitar. He had a successful concert career that took him all over the world, and he visited the United States several times. ",Eastern music enthusiasts in Berkeley probably listened to Banerjee's work on the sitar. ,https://saxonianfolkways.files.wordpress.com/2014/02/bild13.jpg,https://www.youtube.com/watch?v=d3xejzuZPYs,Bismillah Khan,https://en.wikipedia.org/wiki/Nikhil_Banerjee,Musical; classical; folk; eastern,1E,,,"So far two Indian classical musical artists. Also, most sources spell it ""Banerjee"" rather than ""Banarjee,"" but that's what the map says."
Justice,Sandy,Sandy Justice,,,,,,,,,,,,,1E,,,"A man named Sandy Justice has been mentioned in a Berkeley oral history, but that's all I can find. He was a fishing boat engineer. Check here: http://content.cdlib.org/view?docId=kt409nb28g&doc.view=entire_text"
Aarons,Roy,Roy Aarons,12/8/1933,11/28/2004,"New York, NY","New York, NY","Providence, RI; Oakland, CA","Leroy Aarons was a journalist famous for writing for the Washington Post in the 1960s and 1970s, where he covered major events of the 1960s and 1970s such as the assassinations of Martin Luther King Jr. and Robert F. Kennedy. He later became active in LGBT issues. ",Residents of Berkeley probably followed Aaron's work as a journalist. ,http://news.usc.edu/files/img/CHRON3475p1.jpg,,,https://en.wikipedia.org/wiki/Leroy_F._Aarons,Journalist,1E,,,
Allison,Mose,Mose Allison,11/11/1927,11/15/2016,"Tippo, MS","Hilton Head, SC","Baton Rouge, LA; New York, NY","Mose Allison was a jazz and blues pianist and singer. He has been remembered for being one of the most important blues songwriters in the twentieth century, and his work has influenced artists like Jimi Hendrix and the Rolling Stones. He is also remembered for the social criticism and quirky humor apparent in his lyrics and performing style. ",Berkeley jazz and blues enthusiasts probably listened to Allison's music.,https://static01.nyt.com/images/2016/11/16/arts/16Allison-Obit-web4/16Allison-Obit-web4-master768.jpg,https://www.youtube.com/watch?v=pCpekvOkwNM,Jimi Hendrix,https://en.wikipedia.org/wiki/Mose_Allison,Musical; jazz; blues,1E,,,
Clergue,Lucien,Lucien Clergue,8/14/1934,11/15/2014,"Arles, France","Nimes, France","Paris, France","Lucien Clergue was a French photographer known for his friendship with Pablo Picasso. His photographs have appeared in museums around the world, including the Museum of Modern Art in New York. ",Berkeley art and photography enthusiasts probably followed Clergue's work. ,https://upload.wikimedia.org/wikipedia/commons/3/34/Lucien_Clergue%2C_Kunsthaus_Vienna%2C_2007.jpg,https://www.youtube.com/watch?v=d3MSprn4tj4,Pablo Picasso,https://en.wikipedia.org/wiki/Lucien_Clergue,Visual arts,1E,,,
Marash,David,David Marash,,,,,,,,,,,,,1E,,,"There is a David Marash who writes for Al Jazeera, but his career was not active until the 2000s from what I understand. "
Fishman,Bob,Bob Fishman,,,,,,,,,,,,,1E,,,"There is a Bob Fishman who served as chair of the neurology department at UCSF in the 1960s, but I don't think it's him. Check here: https://www.ucsf.edu/news/2012/12/13268/memoriam-robert-fishman-former-chair-neurology-department-dies"
Douglas,Richard,Richard Douglas,,,,,,,,,,,,,1E,,,
Mayo,Tim,Tim Mayo,,,,,,,,,,,,,1E,,,
Hall,Don,Don Hall,9/20/1928,,"Hamden, CT",,"Boston, MA; Ann Arbor, MI; San Francisco, CA","Donald Hall is an author and literary critic who has had a prolific literary career since the 1950s. He is respected for his work as an academic and author of books of poetry, memoirs, essays, and children's books. ",Berkeley intellectuals probably followed Hall's work as an author and academic. ,http://numerocinqmagazine.com/wp-content/uploads/2016/12/Donald-Hall.jpg,https://www.youtube.com/watch?v=Xcf8ENBfeUc,,https://en.wikipedia.org/wiki/Donald_Hall,Literary,1E,,,
McKernan,Ron,Ron McKernan,9/8/1945,3/8/1973,"San Bruno, CA","Corte Madera, CA","San Francisco, CA","Ron McKernan, often known as Pigpen, was a singer and musician known for being a founding member of the Grateful Dead. He and childhood friend Jerry Garcia founded the Grateful Dead in 1965, but his alcoholism forced him to retire from touring with the Dead in 1972. He died from gastrointestinal hemorrhage in 1973.","Pigpen was a native of the Bay Area, and Berkeley locals probably followed the Grateful Dead's music.",https://s-media-cache-ak0.pinimg.com/564x/8c/a0/1f/8ca01f282d0a9ed3d653b1a299ff1c56.jpg,https://www.youtube.com/watch?v=2ozp2P_ENBo,Janis Joplin; Jerry Garcia,https://en.wikipedia.org/wiki/Ron_%22Pigpen%22_McKernan,Musical; psychedelic; rock; folk; Grateful Dead,1E,,,
Bach,Leo,Leo Bach,19-Jun,2/26/2013,"New York, NY","Walnut Creek, CA","Berkeley, CA","Leo Bach was a Berkeley resident who founded local companies the Berkeley Free Press and the Campus Copy Center chain. While he associated with radical politics in the 1960s, his political views drifted to the right later in life. ",Bach was heavily involved in Berkeley through his small businesses and participation in City Council. ,http://ak-cache.legacy.net/legacy/images/cobrands/contracostatimes/photos/wb0044840-1_132810.jpgx?w=130&h=180&option=1&v=0x00000000362b84f1,,,http://www.legacy.com/obituaries/eastbaytimes/obituary.aspx?pid=164294006,Local,1E,,,
Sanders,Markie,Markie Sanders,,,,,Oakland CA,Markie Sanders is a bluegrass bass player who recorded and toured in the Bay Area in the 1960s.,Berkeley bluegrass enthusiasts might have heard Sanders' work in local venues. ,http://www.cbaontheweb.org/cbaadmin/uploads/teacher_21200892128PM.gif,,,http://www.cbaontheweb.org/teacher_viewdtl.asp?teacherid=125,Musical; bluegrass; local,1E,,,
#-1,,E-1,,,,,,,,,,,,,1E,,,"Around the bottom right corner, where Earl Crabb and Rick Shubb list their names, the names on the map get very muddled and small. So the next couple of names are basically guesses."
Hamilton,Bill,Bill Hamilton,8/1/1836,3/7/2000,"Cairo, Egypt","London, United Kingdom","Oxford, United Kingdom","W.D. Hamilton was a British evolutionary biologist who has been remembered for being one of the most significant evolutionary theorists of the twentieth century. Hamilton's Rule, a kin selection inequality that Hamilton himself created, was a landmark discovery in evolutionary theory. ",Berkeley intellectuals (particularly those in the sciences) probably followed Hamilton's work as a biologist.,http://d1vn86fw4xmcz1.cloudfront.net/content/royptb/369/1642/20130356/F1.large.jpg,https://www.youtube.com/watch?v=IjnvNT5ARTk,George R. Price,https://en.wikipedia.org/wiki/W._D._Hamilton,Scientific; academic,1E,,,
Rampa,Lobsang,Lobsang Rampa,4/8/1910,1/25/1981,"Plympton, United Kingdom","Calgary, Canada",,"Cyril Henry Hoskin was a British plumber who wrote books with paranormal themes under the pen name Lobsang Rampa. His most famous book, The Third Eye, claimed to relate the author's experiences growing up in Tibet and gaining powers of clairvoyance. Hoskin claimed that his body hosted the spirit of a Tibetan lama named Tuesday Lobsang Rampa. ","The Third Eye was popular in the 1950s and 1960s, and it has been used to support the Tibetan cause. The mystery of the author of The Third Eye captivated people in the United Kingdom and the United States.  ",https://upload.wikimedia.org/wikipedia/en/thumb/d/d4/Lobsang_Rampa.jpg/150px-Lobsang_Rampa.jpg,https://www.youtube.com/watch?v=fYIwbEcQMLQ,,https://en.wikipedia.org/wiki/Lobsang_Rampa,Literary,1E,,,
,,Richard A-Ravell,,,,,,,,,,,,,1E,,,This is a name right on top of the credits to Earl Crabb and Rick Shubb. It is not very legible so I probably got it wrong. 
