Allen,Steve,Steve Allen,12/26/1921,10/30/2000,"New York, NY","Los Angeles, CA",,Steve Allen was a television personality known for hosting the Tonight Show and later his own show The Steve Allen Show. He was also a prolific composer and pianist. He was one of the most popular television personalities in the 1950s and 1960s. ,Many Berkeley residents probably saw Allen's various television appearances.,https://s3-us-west-2.amazonaws.com/find-a-grave-prod/photos/2008/347/18553_122923294033.jpg,https://www.youtube.com/watch?v=QPwRo0YTTe4,,https://en.wikipedia.org/wiki/Steve_Allen,Television; comedic; musical,5E; 5D,,,
Clark,Old Joe,Old Joe Clark,9/18/1839,4/22/1886,"Clay County, Kentucky","Clay County, Kentucky",Kentucky,"Joseph Clark is the subject of the popular folk song ""Old Joe Clark."" A confederate veteran and known womanizer, Joe lived peaceful life as a store owner, but died in a conspiracy related to one of his girlfriends.","""Old Joe Clark"" was performed by many famous musicians of the folk music revival, including Woody Guthrie and the Kingston Trio.",https://athensdulcimerclub.files.wordpress.com/2012/02/oldjoeclark002.jpg,https://www.youtube.com/watch?v=oEg_85ffiKY,Woody Guthrie,http://www.flyinfiddler.com/tune_oldjoeclark.html; https://en.wikipedia.org/wiki/Old_Joe_Clark,Fictional; Musical; folk,5E; 5D,,,
Stewart,Mary Anne,Mary Anne Stewart,,,,,,,,,,,,,5E; 5D,,,
Greene,Richard,Richard Greene,8/25/1918,6/1/1985,"Plymouth, United Kingdom","Norfolk, United Kingdom","London, United Kingdom",Richard Greene was a British film and television actor who is best known for playing the lead role in the television series The Adventures of Robin Hood. ,"While Greene's career had waned by the 1960s, he was famous for his many film and television appearances. ",https://s-media-cache-ak0.pinimg.com/736x/ab/41/d2/ab41d2f860bc4440c69358b2b7fe7bf6.jpg,https://www.youtube.com/watch?v=ekwtuE0zyOs,,https://en.wikipedia.org/wiki/Richard_Greene,Television,5E; 5D,,,
Watson,Roosevelt,Roosevelt Watson,,4/8/2011,Arkansas,"Albany, CA","Berkeley, CA","Roosevelt Watson was a bluegrass enthusiast and record collector who was active in the Bay Area folk music scene. He was famous for making tapes of live performances by Jerry Garcia, Bill Monroe, and other well-known musicians. ","Watson was heavily involved in the Bay Area folk music scene, and he recorded performances at the Berkeley Folk Music Festival. ",,,Bill Monroe,https://bluegrasstoday.com/roosevelt-watson-remembered/,Local; musical; bluegrass; folk,5E; 5D,,,"Humbead's Map website lists his name as ""Waltson,"" though the map clearly says ""Watson."" Is ""Waltson"" even a real last name?"
Sheats,Michael,Michael Sheats,,,,,"Berkeley, CA","Michael Sheats is an architect based in the Bay Area. He attended Berkeley and specializes in design, construction, and project management. ",Sheats attended Berkeley's architecture school.,,,,http://www.mcsarchitect.com/index.html,Local; Visual arts,5E; 5D,,,I think this is the guy but I can't find any information on him. Why would they include an architecture student on the map? Was he very involved in the local folk music scene? Unsure. 
Escher,M.C.,M.C. Escher,6/17/1898,3/27/1972,"Leeuwarden, Netherlands","Laren, Netherlands","Brussels, Belgium",M.C. Escher was a Dutch graphic artist known for his mathematically inspired woodcuts and lithographs. His art was well-known among mathematicians and became especially famous in popular culture in the 1960s. ,"Escher's art was world-famous in the 1960s, and Berkeley art enthusiasts likely appreciated his work. ",https://upload.wikimedia.org/wikipedia/commons/thumb/6/6a/Escher.jpg/220px-Escher.jpg,https://www.youtube.com/watch?v=Kcc56fRtrKU,,https://en.wikipedia.org/wiki/M._C._Escher,Visual arts,5E; 5D,,,
Lesh,Phil,Phil Lesh,3/15/1940,,"Berkeley, CA",,"San Francisco, CA","Phil Lesh is a bass guitar player known for being a founding member of the Grateful Dead. He met Jerry Garcia while volunteering at the local Bay Area radio stations, and he started playing bass for Garcia's rock group though he had never played bass before. ","Lesh was a native of Berkeley, and he was active in the local music scene even before joining Garcia's band. ",http://www.bam.org/media/3332508/Phil%20Lesh%20613x489.jpg,https://www.youtube.com/watch?v=xC96h3nJXwM,Jerry Garcia; Ron McKernan; Bob Weir; Bob Dylan,https://en.wikipedia.org/wiki/Phil_Lesh,Local; musical; bluegrass; rock; psychedelic; folk; Grateful Dead,5D; 6E; 6D,,,
Gill,Charles,Charles Gill,,,,,,,,,,,,,5E; 6E,,,"There are a couple of Charles Gill's listed on Wikipedia, but none of them seem to fit the bill. "
Selsor,Chris,Chris Selsor,,,,,"Berkeley, CA",Chris Selsor was a folk musician based in Berkeley. He performed at several popular Bay Area venues.,"Selsor was popular in the local folk music scene, and he even performed at the Berkeley Folk Music Festival. ",,,,http://content.cdlib.org/view?docId=kt8s2006h6&brand=calisphere&doc.view=entire_text,Local; musical; folk,5E; 6E,,,
Carleton,Gaither,Gaither Carleton,2/3/1901,6/24/1972,"Wilkes County, NC","Deep Gap, NC",,Gaither Carlton was an old-time fiddle and banjo player known for accompanying Doc Watson in various performances and recordings. He became popular in the 1960s due to the American folk music revival. ,"Carlton was famous in the 1960s for his music, and he might have ventured to Berkeley to perform with his son-in-law and frequent collaborator, Doc Watson. ",http://fieldrecorder.org/wp-content/uploads/2014/10/FRC118GaitherCarlton.jpg,https://www.youtube.com/watch?v=_A2hS8HRgzY,Doc Watson,https://en.wikipedia.org/wiki/Gaither_Carlton,Musical; folk,5E; 6E,,,"Map erroneously spells his name ""Carleton"""
Nichols,Will,Will Nichols,,,,,,,,,,,,,5E; 6E,,,
Hubert,Holy,Holy Hubert,5/211914,2003,Georgia,,"Berkeley, CA; Birmingham, AL; Louisville, KY","Hubert Lindsey, popularly known as ""Holy Hubert,"" was an ordained Southern Baptist minister known for his activity in Berkeley. Hubert came to Berkeley to preach the word of Jesus to the countercultural activists on campus, and he became a well-known local figure due to his vehement opposition to radical politics. He is remembered for being the ""father of campus preaching.""",Lindsey was well-known in Berkeley for his opposition to Berkeley's radical protesters.,http://berkeleyplaques.org/wp-content/uploads/2014/06/Hubert-Lindsey-photo-1968-courtesy-Bible-Truth.jpg,https://www.youtube.com/watch?v=E94nOrizUdo,,http://holyhubert.net/,Local,6E,,,Interesting!
Brown,Toni,Toni Brown,,,,,"Berkeley, CA  ","Toni Brown is a rock musician who was active in the Bay Area rock music scene with her band Joy of Cooking. The Joy of Cooking, a rock band that identified with hippie culture, was one of the first female-fronted rock bands in music history. ","The Joy of Cooking was a prominent local Berkeley band, and they performed at the Berkeley Folk Music Festiva. ",http://cps-static.rovicorp.com/3/JPG_400/MI0001/396/MI0001396550.jpg?partner=allrovi.com,https://www.youtube.com/watch?v=dVYXp84q4mE,,https://en.wikipedia.org/wiki/Joy_of_Cooking_(band),Local; musical; rock; folk; psychedelic,6E,,,Also listed in 6B
Okun,Milt,Milt Okun,12/23/1923,11/15/2016,"New York, NY","New York, NY",,"Milt Okun was a record producer who founded Cherry Lane Music Publishing Company, Inc, which publishes sheet music and books. He produced records from a variety of popular artists including Peter Paul and Mary and John Denver.","Okun was heavily involved in the careers of many of the most famous artists of the folk music revival, so Berkeley folk music enthusiasts were likely familiar with his work. ",http://www.usgo.org/news/wp-content/uploads/2016/11/2016.11.15_milton-okun-gold-records.png,https://www.youtube.com/watch?v=07vVnwayaqo,,https://en.wikipedia.org/wiki/Milt_Okun,Musical; folk,6E,,,
Albin,Peter,Peter Albin,,,,,"San Francisco, CA","Peter Albin is a guitarist best known for founding Big Brother and the Holding Company. He also played with Jerry Garcia in the early sixties, and he briefly joined Country Joe and the Fish. He still plays with Big Brother and the Holding Company today. ","Albin was a mainstay of the local Bay Area folk music scene, and he played at the Berkeley Folk Music Festival with Big Brother and the Holding Company. ",http://www.bbhc.com/wp-content/uploads/2015/05/peter-albin.jpg,https://www.youtube.com/watch?v=mHKL2xSpdAg,Janis Joplin; Country Joe McDonald,http://www.allmusic.com/artist/albin-mn0000263475,Musical; folk; rock; psychedelic; local,6E,,,
Flash,,Flash,,,,,,Flash is a superhero who has appeared in several different comic books published by DC Comics. He has the power of super speed. He is one of the most popular characters of DC Comics' universe. ,"Flash had been appearing in comic books since the 1940s, and he remained one of the most popular superheroes in the 1960s. ",https://upload.wikimedia.org/wikipedia/en/thumb/b/b7/Flash_v1_105.jpg/250px-Flash_v1_105.jpg,https://www.youtube.com/watch?v=0SwwRXRbi2U,Al Williamson,https://en.wikipedia.org/wiki/Flash_(comics),Comic book; fictional,6E,,,
Nichols,Cheryl,Cheryl Nichols,,,,,,,,,,,,,6E,,,Possible relation to Will Nichols? (who I also can't identify)
Samson,Leon,Leon Samson,1932?,,Greece,,"Melbourne, Australia","Leon Samson was a Greek-Australian strongman known for his feats in weightlifting, breaking nails, and eating a car. He was famous in the 1950s and 1960s  for his achievements in his strongman act. ","Leon Samson was popular in the 1960s for his bizarre act, particularly for his attempt to eat a car.",http://www.abc.net.au/news/image/6507640-1x1-340x340.jpg,https://vimeo.com/128954587,,https://www.sunshinecoastdaily.com.au/news/strongman-with-bite-leon-samson/2710705/,Personality,6E,,,This guy is so bizarre. The vimeo video I found is worth checking out.
Goodfellow,Robin,Robin Goodfellow,,,,,,"Robin Goodfellow, better known by Puck, is a character in Shakespeare's A Midsummer Night's' Dream. Puck is a clever, mischievous sprite who meddles with various storylines in the play. ","Puck is one of the most popular characters to appear in a Shakespeare Play. Since a film adaptation of the play premiered in 1968, there likely was a newfound interest in this play in the 1960s. ",http://www.tate.org.uk/art/images/work/N/N05/N05384_10.jpg,https://www.youtube.com/watch?v=vjSg2BVeCMs,,https://en.wikipedia.org/wiki/Puck_(A_Midsummer_Night%27s_Dream),Fictional; literary,6E,,,
Yuark,,Yuark,,,,,,,,,,,,,6E,,,
Cott,Arnie,Arnie Cott,,,,,,,,,,,,,6E,,,
Wiley,Lynn,Lynn Wiley,,,,,,,,,,,,,6E,,,
Kurtzman,Harvey,Harvey Kurtzman,10/3/1924,2/21/1993,"New York, NY","Mount Vernon, NY",,Harvey Kurtzman was a cartoonist and editor best known for writing for writing for Mad in the 1950s and writing the Little Annie Fanny strips in playboy from 1962 to 1988. He was known for his satirical style. ,"Kurtzman was one of the most prominent cartoonists of the 1960s, so Shubb might have been paying homage to this major figure in comics. ",http://s73.photobucket.com/user/toonpro/media/comicscreators/kurtzman/kurtzman3.jpg.html,,Robert Crumb; Wally Wood ,https://en.wikipedia.org/wiki/Harvey_Kurtzman,Comic book,6E,,,
Leroy,,Leroy,,,,,,,,,,,,,6E,,,Name is horizontal
Nelson,David,David Nelson,6/12/1943,,"San Francisco, CA",,"New York, NY","David Nelson is a guitar player best known for founding the country rock band New Riders of the Purple Sage. He was active in the San Francisco music scene, and collaborated with artists like Jerry Garcia, Jefferson Starship, and Phil Lesh. ","Nelson was a mainstay of the Bay Area music scene, and Berkeley residents likely heard his work. ",http://www.gratefulweb.com/sites/default/files/images/10750409_10152636815384667_5943110094680341158_o.jpg,https://www.youtube.com/watch?v=dJQrTzwtZZI,Jerry Garcia; Phil Lesh; Paul Kantner ,https://en.wikipedia.org/wiki/David_Nelson_(musician),Local; musical; folk; bluegrass; rock; psychedelic,6E,,,
Little,Rich,Rich Little,11/26/1938,,"Ottawa, Canada",,"Las Vegas, NV","Rich Little is an impressionist and voice actor who has been credited in several cartoon series as well as talk shows and comedy shows. He is  known for his impersonations of figures like Richard Nixon, Johnny Carson, and Ronald Reagan. ",Little was already famous by the 1960s for his appearances on shows like The Judy Garland Show and That Girl.  ,,https://www.youtube.com/watch?v=qNT8UGydiCQ,,https://en.wikipedia.org/wiki/Rich_Little,Comedic; television,6E,,,
Martin,George,George Martin,1/3/1926,3/8/2016,"London, United Kingdom","Wiltshire, United Kingdom",,"George Martin was a producer, composer, audio engineer, and musician most famous for his work with the Beatles. His involvement with the beatles granted him the nickname ""The Fifth Beatle."" He has also produced recordings for artists like Cheap Trick and Elton John. ","Martin was famous for the 1960s for his work with the Beatles, so Beatles fans in Berkeley surely knew of his work. ",http://cdn4.pitchfork.com/news/64025/393b9e22.jpg,https://www.youtube.com/watch?v=sJTLu4UiJ7o,Paul McCartney; Ringo Starr; John Lennon; George Harrison,https://en.wikipedia.org/wiki/George_Martin#The_Beatles,Musical; rock; Beatles,6E,,,
Petersen,Bobby,Bobby Petersen,1936,1987,"Klamath Falls, Oregon","Burlingame, CA","San Francisco, CA","Bobby Petersen was a poet and friend of Phil Lesh (of the Grateful Dead) who introduced Lesh to the bohemian artistic community in the Bay Area. He is remembered for being a major influence on the Dead, and he even wrote the lyrics to some of their songs. ",http://www.dead.net/features/blog/documenting-dead-robert-m-petersen-papers,,,Phil Lesh,http://www.dead.net/sites/default/files/PetersenbyColardo.jpg,Local; musical; rock; folk; Grateful Dead,6E,,,
Kyser,Maynard,Maynard Kyser,,,,,,,,,,,,,6E,,,
Lester,David,David Lester,,,,,,,,,,,,,6E,,,
Davis,Carol,Carol Davis,,,,,,,,,,,,,6E,,,
Robby,Robinson,Robby Robinson,,,,,,,,,,,,,6E,,,"Hmmm. I want to say this is Robbie Robertson from The Band. There is a bodybuilder named Robby Robinson, but he did not start competing until the 1970s so I don't think that's the guy. "
Tonie,,Tonnie,,,,,,,,,,,,,6E,,,
Smallman,Kirk,Kirk Smallman,,,,,,,,,,,,,6E,,,"There is a man named Kirk Smallman who produced Mural on our Street, a 1965 documentary short, and served as cinematographer to Give Me a Riddle.  I can't find any other information on him, though. "
Greene,Kelly,Kelly Green,7/20/1947,United Kingdom,,"Perth, Australia",,Kelly Green is an Australian singer who has performed and recorded since the 1960s. She has performed several pop and rock and roll songs throughout her long career. ,"Green was already famous in the 1960s for some of her songs like ""Little Girl Lost"" and ""Little Miss Lonely.""",https://upload.wikimedia.org/wikipedia/commons/thumb/c/c9/Kelly_Green_in_concert%2C_2011.jpg/220px-Kelly_Green_in_concert%2C_2011.jpg,https://www.youtube.com/watch?v=PnhBdELCmh4,,https://en.wikipedia.org/wiki/Kelly_Green_(musician),Musical; pop; rock,6E,,,I am unsure if this is a reference to the musician (I don't know how popular she was in the US) or the color. 
Opie,Jim,Jim Opie,,,,,,,,,,,,,6E,,,
Campbell,Barbara,Barbara Campbell,,,,,,,,,,,,,6E,,,"Sometimes when I work on this map I run into ""deserts"" where I can't identify 5-10 names at a time. This is one of those desserts. "
Glickman,Lee,Lee Glickman,,,,,,,,,,,,,6E,,,
Gray,Chris,Chris Gray,,,,,,,,,,,,,6E,,,Lots of musicians named Chris Gray. All of them are too young to have been performing in the 1960s. 
Gibbs,Skip,Skip Gibbs,,,,,,Skip Gibbs was a folk and country musician who made some recordings in the 1960s.,Berkeley folk music enthusiasts might have heard of Gibbs' music. ,,https://www.youtube.com/watch?v=C8nHN5zdMY0,,https://www.discogs.com/artist/2293409-Skip-Gibbs,Musical; folk,6E,,,All I can really find is a Discogs profile. Very limited info. 
Gurland,Bob,Bob Gurland,,,,,,Bob Gurland was a trumpeter who played for various folk and rock bands like the Even Dozen Jug Band and Jake and the Family Jewels. ,"Gurland was active in the folk music scene of the 1960s, so Berkeley folk music enthusiasts might have known about his work. ",,,,https://www.discogs.com/artist/637993-Bob-Gurland,Musical; folk,6E,,,Very limited info.
Goodrich,Ray,Ray Goodrich,,,,,,,,,,,,,6E,,,
Fredrickson,Dave,Dave Fredrickson,8/11/1927,8/28/2012,"Berkeley, CA","Walnut Creek, CA",,"Dave Fredrickson was an archaeologist, anthropologist, and folk singer. While archaeology was his main career, he recorded an album, Songs of the West, with Folkways Records in 1961 and continued to perform old-time and cowboy songs for the rest of his life. ","Fredrickson was a lifelong resident of the Bay Area, and he attended Berkeley as an undergraduate. He was active in the local folk music scene, and he performed at the Berkeley Folk Music Festival. ",http://berkeleyplaques.org/wp-content/uploads/2014/02/Fredrickson_02.jpg,https://www.youtube.com/watch?v=6Fx1CAHLolI,,https://en.wikipedia.org/wiki/Dave_Fredrickson,Musical; country; folk; local,6E,,,
MacDermed,Charles,Charles MacDermed,,,,,,,,,,,,,6E,,,"I found two Berkeley-related sources that mention a Charles MacDermed, but it's not very helpful information: http://www.cuke.com/Cucumber%20Project/interviews/macdermed.html, https://books.google.com/books?id=-uSNYnr3VWIC&pg=PA281&lpg=PA281&dq=charles+macdermed&source=bl&ots=Cc6iwmdCsl&sig=E2rGI4Q4z9XY6cj8t_m7DwGbRPU&hl=en&sa=X&ved=0ahUKEwjKq4u92JHUAhVM6IMKHVXUB9kQ6AEISTAH#v=onepage&q=charles%20macdermed&f=false"
Draheim,Sue,Sue Draheim,8/17/1949,4/11/2013,"Oakland, CA","Berea, KY","Berkeley, CA; London, United Kingdom","Sue Draheim was a fiddler who was active in the Bay Area music community. She played in various Berkeley string ensembles, and played for local folk music groups like  Dr. Humbead's New Tranquility String Band and the Golden Toad. She proceeded to have a long career in the United Kingdom and the United States. ","Draheim was very active in the Bay Area folk music scene in the 1960s, and she performed at the Berkeley Folk Music Festival several times. In fact, her photograph appeared on the poster for the 1968 Berkeley Folk Music Festival. ",http://www.thefreight.org/sites/default/files/130401a.jpg,https://www.youtube.com/watch?v=f7vdnsnMjKM,Mike Seeger,https://en.wikipedia.org/wiki/Sue_Draheim,Musical; folk; local,6E,,,
Jackard,John,John Jackard,,,,,,,,,,,,,6E,,,
Bull,Sandy,Sandy Bull,2/25/1941,4/11/2001,"New York, NY","Nashville, TN",,"Sandy Bull was a folk musician and composer who played the guitar, mandolin, banjo, and oud. He was one of the first musicians to blend non-western instruments with American folk music, and this combination was influential in the development of psychedelic music. ","Bull was famous for his eclectic music in the 1960s, and he performed at the Berkeley Folk Music Festival. So, Berkeley folk enthusiasts were likely familiar with his work. ",http://c341319.r19.cf1.rackcdn.com/sandy-bull-the-rhythm-ace-live-1976-main.jpg,https://www.youtube.com/watch?v=e5O24x_Ofm0,,https://en.wikipedia.org/wiki/Sandy_Bull,Musical; folk; psychedelic,6E,,,
Kesey,Ken,Ken Kesey,9/17/1935,11/10/2001,"La Junta, CO","Eugene, OR","La Honda, CA; Palo Alto, CA","Ken Kesey was a novelist and major counter cultural figure of the 1960s. After writing One Flew Over the Cuckoo's Nest, a critically acclaimed novel, in 1960, Kesey became involved in the 1960s counterculture and formed the traveling group the Merry Pranksters. He became famous for hosting Acid Tests with the Merry Pranksters, and he was also a major influencer on the Grateful Dead. ","Kesey is one of the most famous countercultural figures of the 1960s, and he lived in the Bay Area for a number of years. Furthermore, his involvement with the Grateful Dead meant that he was somewhat active in the 1960s rock/folk music scene. ",https://cdn2.hubspot.net/hub/237126/file-1598212874-jpg/ken_kesey.jpg,https://www.youtube.com/watch?v=X_8rlyGWLkg,Jerry Garcia,https://en.wikipedia.org/wiki/Ken_Kesey,Literary; Grateful Dead,6E,,,
Bradley,Hank,Hank Bradley,,,,,"Berkeley, CA",Hank Bradley was a fiddler who was involved in the Berkeley folk music scene. He often played at local venues like the Jabberwock.,"Bradley was well-involved in the local folk music scene, and he collaborated with local artists like Rick Shubb. ",,,,http://berkeleyfolk.blogspot.com/2010/01/09-july-1967-wake-for-wock.html,Local; musical; folk,6E,,,Limited info
Tubb,Ernest,Ernest Tubb,2/9/1914,9/6/1984,"Crisp, TX","Nashville, TN","San Antonio, TX","Ernest Tubb, often known as the Texas Troubadour, was a singer-songwriter known for being one of the pioneers of honky-tonk style country music. He recorded hits like ""Walking the Floor Over You"" and ""Blue Christmas.""","Tubb was one of the most famous country stars of the mid-twentieth century, so Berkeley country enthusiasts likely listened to his songs. ",https://upload.wikimedia.org/wikipedia/commons/9/9e/Ernest_Tubb_publicity_portrait_-_Cropped.jpg,https://www.youtube.com/watch?v=nWmbFXJDHrM,,https://en.wikipedia.org/wiki/Ernest_Tubb,Musical; country,6E,,,
Wilcox,Doug,Doug Wilcox,,,,,,,,,,,,,6E,,,"There is a country musician named Doug Wilcox plays country music, but he looks a little too young to have been playing in the 1960s. Perhaps there is a relation to David Wilcox, who performed at the Berkeley Folk Music Festival, or Yvonne Wilcox, another person identified on the map whom I couldn't identify?"
Arkin,Steve,Steve Arkin,1944,,"New York, NY",,,"Steve Arkin is a banjo player who specializes in bluegrass and country music. He was active in the New York folk music scene in the 1960s, and played with bands like Bill Monroe's Bluegrass Boys and Northern Lights, a Boston-based ""newgrass"" band. He continues to play in various bands today. ","Arkin was popular in the 1960s for his bluegrass playing, and he was especially known for working with famous artist like Bill Monroe and Bill Keith. ",http://musiccampsnorth.com/wp-content/uploads/2015/03/SteveArkinBCN.jpg,https://www.youtube.com/watch?v=HiCM_D9j2q8,Bill Monroe; Bill Keith,http://www.allmusic.com/artist/steve-arkin-mn0000321862/biography,Musical; bluegrass; country,6E,,,
Mahal,Taj,Taj Mahal,5/17/1942,,"New York, NY","Springfield, MA; Santa Monica, CA; Kauai, HI",,"Henry Saint Clair Fredericks, known by his stage name Taj Mahal, is a blues musician who plays the guitar, banjo, piano, and harmonica. He is considered an influential figure in blues music due to his fusion of blues with other music from the Caribbean, Africa, and the South Pacific. ","Taj Mahal was at the height of his career in the 1960s, and he is known to have inspired various bands like the Rolling Stones. He performed at the Berkeley Folk Music Festival, so Berkeley residents were likely familiar with his music. ",http://rubbercityreview.com/wp-content/uploads/2012/07/Taj-Mahal.jpg,https://www.youtube.com/watch?v=tAPqGZNtXTE,,https://en.wikipedia.org/wiki/Taj_Mahal_(musician),"Musical, blues",6E,,,
Friedman,Bill,Bill Friedman,,,,,,,,,,,,,6E,,,"There is a Bill Friedman listed along with folk musicians like Artie Traum and Steve Arkin on a website I found, but that's all I got. Look here: http://www.leedsguitar.com/blog/the-guitar-time-forgot/?print=print"
Wells,Patty,Patty Wells,,,,,,,,,,,,,6E; 6D,,,
Wood,Wally,Wally Wood,6/17/1927,11/2/1981,"Menahga, MN","Los Angeles, CA","Minneapolis, MN New York, NY","Wally Wood was a comic book writer and independent publisher best known for his work on Mad (for which he was a founding cartoonist) and the Daredevil comic book. He also became involved in alternative comics, and he published the independent magazine witzend. ","Wood was a prominent comic book artist of the mid-twentieth century, and he was involved in several different publications both mainstream and independent. ",https://vignette2.wikia.nocookie.net/marveldatabase/images/8/86/Wally_Wood.jpg/revision/latest/scale-to-width-down/200?cb=20130427164131,https://www.youtube.com/watch?v=o_KwzCarm_0,Harvey Kurtzman; Bill Pearson ,https://en.wikipedia.org/wiki/Wally_Wood,Comic book,6E; 6D,,,
Kweskin,Jim,Jim Kweskin,7/18/1940,,"Stamford, CT","Boston, MA",,"Jim Kweskin is a guitar player known for founding the Jim Kweskin Jug Band, which was active in Boston in the 1960s. He is also known for being a founding member member of the Fort Hill Community, which he is still involved in today. ","The Jim Kweskin Jug Band was one of the most popular jug bands of the 1960s, and they performed at the Berkeley Folk Music Festival. ",http://lehibou.ca/sites/default/files/styles/for2column/public/Jim%20Kweskin.jpg?itok=TO1O00So,https://www.youtube.com/watch?v=_m8h6Gq5utE,Marilyn Eckbo; Mel Lyman,https://en.wikipedia.org/wiki/Jim_Kweskin,Musical; folk,6E; 6D,,,
Stravinski,Igor,Igor Stravinski,6/5/1882,4/6/1971,"St. Petersburg, Russia","New York, NY","Paris, France; Los Angeles, CA,","Igor Stravinsky Russian-born composer who had a revolutionary impact on twentieth-century musical composition with works like the Rite of Spring. He is particularly remembered for the diversity in his composition, which ranged from Russian folk music to neoclassical.","Stravinsky in Los Angeles for several years in the 1940s (even has a star on the Walk of Fame). Furthermore, Berkeley classical music enthusiasts likely knew of Stravinsky considering that he was one of the most famous composers of the twentieth century. ",https://ichef.bbci.co.uk/images/ic/960x540/p01bqkcw.jpg,https://www.youtube.com/watch?v=mUwdyN27TWI,,https://en.wikipedia.org/wiki/Igor_Stravinsky,Musical; classical  ,6E; 6D,,,"Normally spelled ""Stravinsky"" with a Y in English. "
